Name,Pattern Type,Neckline
Letter Graphic Short Sleeve Tee,Letter  Halloween,Round Neck
Leaf Print Contrast Lace Scallop Hem Mock Neck Dress,Plants  All Over Print,Stand Collar
Button Front Satin Top,Plain,Collar
Belted Peter Pan Collar Dress,Heart  All Over Print,Peter Pan Collar
Twist Back Striped Top,Striped,Round Neck
Zipper Fly Slant Pocket PU Palazzo Pants,Plain,NA
Square Neck Tie Back Ruffle Trim Crop Top,Plain,Square Neck
Cold Shoulder Rib-knit Tee,Colorblock,Cold Shoulder
Tie Neck Solid Top,Plain,Tie Neck
Ditsy Floral Print Drawstring Top,Ditsy Floral,V neck
Elastic Waist Striped Skirt,Striped,NA
Button Up Crop Tee,Plain,Notched
Plunging Neck Floral Print Lantern Sleeve Dress,Floral  All Over Print,V neck
High Neck Sleeveless Bodycon Dress,Plain,High Neck
Shirred Back Satin Bralette Top,Plain,Spaghetti Strap
Surplice Wrap Maxi Satin Dress,Plain,Spaghetti Strap
Corduroy High Waisted Wide-Leg Pants,Plain,NA
Plaid High Rise Tailor Pants,Plaid,NA
Ruffle Trim Floral Organza Lantern Sleeve Top,Floral,Round Neck
Cut-and-sew Leopard Dress,Colorblock  Leopard,Round Neck
Contrast Stitch Rhinestone Chain Lace-up Front Crop Top,NA,V neck
Mock Neck Self Belted Split Back Dress,Plain,Stand Collar
Plaid Slant Pocket Shorts,Plaid,NA
Sweetheart Neck Wrap Hem Satin Dress,Plain,Sweetheart
Paperbag Waist Belted Grid Pants,Plaid,NA
Letter and Car Print Top,Letter  Graphic,Round Neck
Lettuce Edge Crop Top,Plain,Straps
V-Neck Rib-knit Bodycon Dress,Plain,V neck
Solid Short Sleeve Tee,Plain,Round Neck
One Shoulder Solid Crop Tee,Plain,One Shoulder
Guipure Lace Trim Button Front Ruffle Hem Dress,Plain,Deep V Neck
PU High Waist Leggings,Plain,NA
Rib-knit Crop Cami Top,Plain,Spaghetti Strap
Drawstring Side Waffle Knit Bodycon Dress,Plain,Round Neck
BASICS Mock-Neck Crop Top,Plain,Stand Collar
Solid Rib-knit Velvet Tee,Plain,Round Neck
V Neck Split Thigh Cami Dress,Plain,V neck
Double Strappy One Shoulder Bodycon Dress,Plain,One Shoulder
High Neck Lettuce Trim Rib-knit Tee,Plain,High Neck
HouseOfChic Drawstring Knot Ditsy Floral Shirred Bodycon Dress,Ditsy Floral,Off the Shoulder
Confetti Heart Print Slit Back Mermaid Skirt,Heart  All Over Print,NA
Off Shoulder Guipure Lace Trim Top,Colorblock,Off the Shoulder
Buttoned Side Split Hem PU Leather Skirt,Plain,NA
Guipure Lace Trim Button Front Ruffle Hem Dress,Plain,Deep V Neck
Button Up Split Hem Jacquard Skirt,Leopard,NA
Tribal Print M-slit Skirt,Tribal,NA
Neon Orange High Waist Legging Shorts,Plain,NA
Solid Bandana Tube Top,Plain,Strapless
Drawstring Ruched Side Rib-knit Bodycon Dress,Plain,Round Neck
Button Front Space Dye A-line Dress,NA,Round Neck
SBetro High Waist Slit Hem Velvet Pants,Plain,NA
V-neck Raglan Sleeve Tee,Plain,V neck
Plaid Tweed Button Front Skort,Plaid,NA
Quilted Velvet Bodycon Mini Skirt,Plain,NA
BASICS Stand Collar Rib-knit Bodycon Dress,Plain,Stand Collar
Joyfunear Ruffle Hem Ruched Bardot Dress,Plain,Off the Shoulder
Leopard Side Striped Skinny Leggings,Striped  Leopard,NA
Floral Print High-Rise Pencil Skirt,Floral  All Over Print,NA
Angel Graphic Cropped Tank Top,Letter,Scoop Neck
V-neck Button Placket Striped Top,Striped,V neck
V Neck Rib-knit Crop Top,Plain,V neck
Gingham High Waist Skirt,Gingham,NA
Ruffle Trim Button Up Blouse,Plain,Collar
Surplice Neck Bishop Sleeve Belt Dress,Plain,V neck
Plunging Neck Rib-knit Tank Top,Plain,Deep V Neck
Contrast Stitch Lettuce Trim Colorblock Crop Tee,Colorblock,Round Neck
Notched Lettuce Trim Rib-knit Dress,Plain,Notched
Ruched Drawstring Front Ruffle Cuff Crop Top,Plain,Square Neck
Solid Slant Pocket Suede Shorts,Plain,NA
Solid Crew Neck Drawstring Side Tee Dress,Plain,Round Neck
Plunging Neck Lace Up Crop Tank Top,Plain,Deep V Neck
Crisscross Striped Bardot Tee,Striped,Off the Shoulder
Ditsy Floral Lettuce Trim Bodycon Dress,Ditsy Floral,Spaghetti Strap
Split Hem Plaid Skirt,Plaid,NA
Zip Front Fitted Crop Tee,Plain,Deep V Neck
Contrast Lace Button Back Tee,Plain,Round Neck
Slogan Embroidered Lettuce Edge Rib-knit Dress,Slogan,Round Neck
Mock-Neck Cut Out Front Top,Plain,Stand Collar
Flounce Sleeve Self Belt Wrap Satin Dress,Plain,V neck
Pocket Front Button Fly Skinny Pants,Plain,NA
Keyhole Back Mesh Lantern Sleeve Top,Plain,Round Neck
Paper Bag Waist Pinafore Skirt,Plain,NA
Snakeskin Pattern Leather Look Crop Tank Top,Snakeskin Print,Scoop Neck
Drop Shoulder Crop Tee,Plain,V neck
Zip Back Boxy Pleated Skort,Plain,NA
Pearl Beaded Velvet Skinny Pants,Plain,NA
Drop Shoulder Tartan Print Blouse,Tartan,Collar
Scoop Neck Bishop Sleeve Tee,Plain,Scoop Neck
Surplice Neck Floral Dress,Floral  All Over Print,V neck
Ruffle Hem Swiss Dot Belted Dress,Plain,Round Neck
Puff Sleeve Keyhole Back Tunic Dress,Plain,Round Neck
Drop Shoulder Buttoned Plaid Longline Blouse,Plaid,Collar
Solid Wide Waistband Leggings,Plain,NA
Button Front Cord Skirt,Plain,NA
Mock-Neck Letter Graphic Top,Letter  All Over Print,Stand Collar
Knotted Waist Flap Pocket Side Joggers,NA,NA
Solid Ruched High Low Dress,Plain,V neck  Collar
BASICS Mock Neck Bodycon Dress,Plain,Stand Collar
Slant Pocket Detail Slit Hem Skinny Pants,Plain,NA
Lettuce Trim Drawstring Ruched Front Solid Tee,Plain,V neck
Belted Wide Leg Pants,Plain,NA
Solid Pocket Front Sweatpants,Plain,NA
Shirred Wide Waistband Shorts,Plain,NA
Checker Plaid Colorblock Crop Tee,Plaid,Round Neck
Floral Print Ruffle Hem Dress,Floral,V neck
Knot Shoulder Slit Hem Buffalo Plaid Overall Dress,Gingham,Spaghetti Strap
Contrast Stitch Trim Crop Top,Plain,V neck
High Waist Plaid Skirt,Plaid,NA
Double V Neck Contrast Lace Tee,Colorblock,V neck
BASICS Split Thigh Solid Satin Skirt,Plain,NA
Solid Fringe PU Leather Skirt,Plain,NA
One Shoulder Rib-knit Crop Top,Plain,One Shoulder
Solid Rib-knit Crop Tank Top,Plain,Round Neck
Solid Rib-Knit Tank Top,Plain,Round Neck
BASICS Wide Leg Drawstring Waist Pants,Plain,NA
Slant Pocket Buffalo Plaid Pants,Gingham,NA
V Neck Pearls Beaded Sleeve Blouse,Plain,V neck
Swiss Dot Side Solid Dress,Plain,Round Neck
Ditsy Floral Print Ruffle Hem Belted Dress,Ditsy Floral,V neck
BASICS Solid Boat Neck Bodycon Dress,Plain,Boat Neck
Cut Out Waist Rib-knit Bodycon Dress,Plain,Spaghetti Strap
Solid High Waist Pleated Skirt,Plain,NA
Skull Print Tee,Halloween,Round Neck
Tie Neck Ruched Bust Zebra Striped Mesh Slip Dress,Zebra Stripe,Spaghetti Strap
Fold Pleated Solid Pants,Plain,NA
Letter and Angel Print Rib-knit Tank Top,Letter  Figure,Scoop Neck
Notched Neck Rib-knit Lettuce Hem Bodycon Dress,Plain,Notched
Drawstring Waist Reflective Joggers,Plain,NA
Notch Neck Batwing Sleeve Striped Top,Striped,Notched
Polka Dot Off-the-Shoulder Tee,Polka Dot,Sweetheart
Catch Flights Not Feelings Graphic Biker Shorts,Slogan,NA
Faux Croc Leather Slit Pencil Skirt,Crocodile,NA
Contrast Collar And Cuff Polo Tee,Colorblock,Polo
Missord Off Shoulder Mesh Insert Split Thigh Sequin Prom Dress,Plain,Off the Shoulder
Turtle Neck Drop Shoulder Solid Dress,Plain,High Neck
Ruffle Trim Lace Up Corset Laser Cut Hem PU Leather Skirt,Plain,NA
Neon Pink Sweetheart Neck Rib-knit Bodycon Dress,Plain,Sweetheart
Layered Ruffle Hem Mesh Skirt,Plain,NA
Rib-knit Bodycon Dress,Plain,Square Neck
Tartan Pleated Skirt,Tartan,NA
Criss Cross Cut Out Drawstring Side Bodycon Dress,Plain,Round Neck
Mock Neck Pearl Beaded Tee,Plain,Stand Collar
Lettuce Trim Daisy Floral Print Bodycon Dress,Floral  All Over Print,Spaghetti Strap
Frill Trim Ruched Bust Shirred Back Swiss Dot Crop Top,Plain,Square Neck
Paperbag Waist Button Front Midi Skirt,Plain,NA
Surplice Neck Swiss Dot Dress,Plain,V neck
Polka Dot Knot Side Ruffle Trim Wrap Cami Dress,Polka Dot,Spaghetti Strap
Mesh Insert Colorblock Leggings,Colorblock,NA
Double Crazy High Waist Plaid Cropped Pants,Plaid,NA
Zipper Side Solid Satin Skirt,Plain,NA
Ruched Bust Tie Front Gingham Cami Dress,Gingham,Spaghetti Strap
Wide Waistband Leggings,Plain,NA
Tie Front Ruched Bust Ditsy Floral Dress,Ditsy Floral,Spaghetti Strap
Solid Crop Tank Top,Plain,Round Neck
Rib-knit Form Fitted Solid Tee,Plain,Round Neck
Tie Back Rib-knit Crop Tee,Plain,Round Neck
Mesh Insert Halter Bodycon Dress,Plain,Halter
Missord Split Mermaid Hem Floor Length Tube Prom Dress,Plain,Strapless
High Waist Solid Biker Shorts,Plain,NA
Square Neck Puff Sleeve Frill Trim Gingham Dress,Gingham,Square Neck
Ruched Bust Seam Front Tie Dye Cami Top,Tie Dye,Spaghetti Strap
Notched Collar Ombre Mesh Overlay Combo Dress With Belt,Colorblock  Ombre,Lapel
Solid Textured Knit Biker Shorts,Plain,NA
One Shoulder Cutout Ruched Bodycon Dress,Plain,One Shoulder
Floral Print Shirred Back Puff Sleeve Dress,Floral  All Over Print,Deep V Neck
Simple Flavor Ruffle Trim Floral Cami Dress,Floral,Square Neck
Drawstring Waist Wide Leg Pants,Plain,NA
Heart Decoration Biker Shorts,Plain,NA
Corduroy Zipper Front Mini Skirt,Plain,NA
Tied Backless Sequin Dress,Colorblock,Round Neck
Contrast Top-stitching High Waist Leggings,NA,NA
Elastic Waist Wide Leg Shorts,Plain,NA
Lettuce Trim Ruched Detail Bodycon Dress,Plain,High Neck
Drawstring Ruched Side Bodycon Dress,Plain,Round Neck
Surplice Neck Belted Fitted Dress,Plain,V neck
Joyfunear Off Shoulder Ruched Mesh Dress,Plain,Off the Shoulder
Crisscross Tie Waist Ruched Slit Hem Skirt,Plain,NA
D&M Ruched Crisscross Rhinestone Detail Velvet Cami Dress,Plain,Spaghetti Strap
Frill Waist Tribal Print Shorts,Tribal,NA
Letter Graphic Short Sleeve Tee,Letter,Round Neck
Floral Print Shawl Collar Combo A-line Dress,Floral,Shawl Collar
Paperbag Waist Knotted Hem Belted PU Leather Pants,Plain,NA
Tie Back Satin Bandana Top,Plain,Strapless
Solid Racerback Tank Top,Plain,Round Neck
Double Crazy Mesh Puff Sleeve Off Shoulder Rhinestone Dress,Plain,Off the Shoulder  Notched
Off Shoulder Lace Up Front Ruched Mesh Dress,Plain,Off the Shoulder
Solid Raw-Cut Boxy Cropped Tee,Plain,Round Neck
Cow Print Scoop Neck Tie Front Tee,Animal,Scoop Neck
Contrast Stitch Ruffle Hem Bodycon Dress,NA,Stand Collar
Drawstring Side Solid Tee,Plain,Round Neck
Ditsy Floral Print Ruched Bust Crop Top,Ditsy Floral,Strapless
Tie Front Satin Crop Tube Top,Plain,Strapless
Lip And Heart Print Tee,Figure  Heart,Round Neck
Checked Pleated Skirt,Plaid  Colorblock,NA
Two-Toned High Waisted Joggers,Colorblock,NA
Elastic Waist Straight Skirt,Plain,NA
Rolled Neck Tank Top,Plain,High Neck
Sheer Lace Raglan Sleeve Colorblock Tee,Colorblock,Boat Neck
Letter and Tower Print Rib-knit Cami Top,Letter  Graphic,Spaghetti Strap
Zebra Stripe Straight Skirt,Zebra Stripe,NA
Floral Print Cami Dress,Floral  All Over Print,Spaghetti Strap
Ditsy Floral Print Slant Pocket Wide Leg Pants,Ditsy Floral,NA
Twist Front Peekaboo Floral Cami Dress,Floral,Spaghetti Strap
Button Front Lantern Sleeve Smock Dress,Plain,Round Neck
Rib-knit Solid Bodycon Dress,Plain,Spaghetti Strap
Eyelet Lace Up Knot Cut-out Sheer Mesh Yoke Bodycon Dress,Plain,Tie Neck
Faux Leather High-Rise Leggings,Plain,NA
Sheer Lace Lantern Sleeve Rib-knit Dress,Plain,Round Neck
Camo Print Wide Waistband Leggings,Camo,NA
Asymmetrical Neck Hidden Pockets Tee Dress,Plain,Asymmetrical Neck
Surplice Neck Cow Print Bodycon Dress,Animal,Spaghetti Strap
Zipper Side Flowy Hem PU Skirt,Plain,NA
Lace Panel Leopard Print Crop Cami Top,Leopard,Spaghetti Strap
Round Neck Striped Dress,Striped,Round Neck
Floral Sweetheart Ruched Peekaboo Front A-line Dress,Floral  All Over Print,Sweetheart
Solid Stand Collar Satin Dress,Plain,Stand Collar
Ditsy Floral Print Fit & Flare Mini Dress,Ditsy Floral,Spaghetti Strap
Slant Pocket Solid Sweatpants,Plain,NA
Ribbed Cropped Tank Top,Plain,Round Neck
Crisscross Backless Leopard Dress,Leopard,Spaghetti Strap
Tie Neck Frill Trim A-line Dress,Plain,Tie Neck
Release-Buckled Belt Cargo Joggers,Plain,NA
Single Breasted Rib-knit Dress,Plain,Polo
Cut Out High Waist Wide Leg Pants,Plain,NA
Camo Print Elastic Waist Cargo Pants,Camo,NA
Lace Up Cutout Front Bodycon Dress,Plain,Round Neck
Corduroy High-Rise Straight-Leg Pants,Plain,NA
Plunging Neck Rib-knit Slim Tee,Plain,V neck
Ruched Bust Frill Trim Bow Detail Bodycon Dress,Plain,Straps
Paperbag Waist Pleated Skirt,Plain,NA
Drawstring Ruched Allover Heart Print Dress,Heart  All Over Print,Sweetheart
Flounce Sleeve Tie Neck Swiss Dot Dress,Plain,Tie Neck
Surplice Neck Lantern Sleeve Swiss Dot Dress,Plain,V neck
Notch Neck Button Front Tank Top,Plain,Notched
Corduroy Overall Mini Dress,Plain,Straps
Paperbag Waist Knot Front Shorts,Plain,NA
Butterfly Embroidered Lettuce Edge Rib-knit Dress,Animal,Off the Shoulder
Allover Print Lace Detail Crop Cami Top,All Over Print,Spaghetti Strap
Solid Foldover Split Thigh Bardot Dress,Plain,Off the Shoulder
Chain Detail Color Block Gingham Pants,Colorblock  Gingham,NA
Floral Print Ruched Mesh Skirt,Floral  Patchwork,NA
Slant Pocket Corduroy Flare Pants,Plain,NA
Tie Neck Ruffle Hem Plaid Tweed Dress,Plaid  Colorblock,Tie Neck
Zipper Back Rib-knit Velvet Dress,Plain,Round Neck
Contrast Lace Detail Rib-knit Crop Cami Top,Colorblock,Spaghetti Strap
Contrast Lace Crop Cami Top,Plain,Spaghetti Strap
Lace Trim Floral Print Dress,Floral  All Over Print,Spaghetti Strap
Drawstring Ruched Slim Tee,Plain,Round Neck
Lace Trim Lettuce Edge Leopard Dress,Leopard,Spaghetti Strap
Letter Graphic Drop Shoulder Tee,Letter,Round Neck
Elastic Waist Plaid Pants,Plaid,NA
Lettuce Trim Daisy Floral Bodycon Dress,Floral  All Over Print,Spaghetti Strap
Satin Panel One Shoulder Solid Dress With Transparent Strap,Plain,One Shoulder
Snakeskin Print Vented Mini Skirt,Snakeskin Print,NA
Swiss Dot Bishop Sleeve Chiffon Dress,Plain,Round Neck
Solid Self-Tie High-Rise Skorts,Plain,NA
Cuffed Cord Shorts,Plain,NA
Off-the-shoulder Allover Print Blouse,All Over Print,Off the Shoulder
Button Front Rib-knit Tee,Colorblock,V neck
Elastic Waist Double Pocket Track Shorts,Plain,NA
Twist Peekaboo Front Tie Back Floral Print Slip Dress,Floral,Spaghetti Strap
Paperbag Waist Belted Colorblock Shorts,Colorblock,NA
V-neck Tied Open Back Crop Top,Plain,V neck
V Neck Solid Fitted Crop Tee,Plain,V neck
Heart Print Lettuce Edge Dress,Heart  All Over Print,Spaghetti Strap
Color Block Stripe Tunic Dress,Colorblock,Round Neck
Slogan Graphic Rib-knit Crop Tank Top,Slogan,Round Neck
Joyfunear Ruched Glitter Mesh Bustier Dress,Plain,Spaghetti Strap
Fishnet Pattern High Waist Pants,Plain,NA
Asymmetrical Waistband Leggings,Plain,NA
Raglan Sleeve Tie Front Flare Satin Dress,Plain,Round Neck  Tie Neck
Graphic Print Biker Shorts,Graphic,NA
Color Block Leopard Rib-knit Dress,Colorblock  Leopard,Round Neck
Ditsy Floral Ruffle Trim Belted A-line Dress,Ditsy Floral,Square Neck
Double Button Plaid Tweed Skirt,Plaid,NA
Solid Satin Skirt,Plain,NA
Dragon Print Bodycon Cami Dress,Animal  All Over Print,Spaghetti Strap
Tie Back Fringe Hem Halter Top,Plain,Halter
Plunging Neck Ruched Bodycon Dress,Plain,Deep V Neck
Tartan Pleated High Rise Skirt,Tartan,NA
Solid Drawstring Waist Sweatpants,Plain,NA
O-zip Fly Corduroy Skinny Pants,Plain,NA
Surplice Neck Velvet Crop Cami Top,Plain,Spaghetti Strap
Ruched Bust Tied Backless Appliques Top,Floral,Round Neck
Lettuce Trim Galaxy Mesh Dress,Galaxy,Spaghetti Strap
Zip Back Tweed Dress,Plaid,Round Neck
Batwing Sleeve Shirred Waist Floral Dress,Floral  All Over Print,Deep V Neck
Solid Flare Leg Velvet Pants,Plain,NA
Ribbed Off-the-Shoulder Top,Plain,Off the Shoulder
Allover Floral Print Statement Collar A-line Dress,Floral  All Over Print,Round Neck
Flounce Sleeve Shirt Dress Without Belt,Plain,Collar
MOTF PREMIUM RAYON RIBBED KNIT CROP TOP,Plain,Round Neck
Drop Shoulder Pocket Patch Button Front Coat,Plain,Collar
BASICS Mock Neck Solid Crop Tee,Plain,Stand Collar
Confetti Print Bishop Sleeve Tiered Layer Dress,All Over Print,V neck
Ruched Bust Leopard Bandana Cami Top,Leopard,Spaghetti Strap
Zebra Stripe Puff Sleeve Split Thigh Dress,Zebra Stripe,Square Neck
Fishnet Mesh Insert Floral Dress,Floral  Colorblock,Stand Collar
Lace Trim Tie Front Satin Top,Plain,NA
Missord Polka Dot Mesh Lantern Sleeve Pearl Beaded Dress,Polka Dot  Colorblock,Off the Shoulder
Plaid High-Rise Split Mini Skirt,Tartan,NA
Tie Front Stitch Trim Rib-knit Top,NA,Deep V Neck
BASICS Scoop Neck Solid Long Sleeve Bodycon Dress,Plain,Scoop Neck
Overlap Collar Eyelet Embroidery Smock Dress,Plain,V neck
Drawstring Waist Tie Dye Sweatpants,Tie Dye,NA
Color-block Polo Neck Tee Dress,Colorblock,Polo
Frill Trim Solid Cami Dress,Plain,Spaghetti Strap
Funnel Neck Lantern Sleeve Rib-knit Top,Plain,Funnel Neck
Flounce Hem Solid Dress,Plain,Round Neck
Back V-cut Eyelet Embroidered Tee,Colorblock,V neck
Grid Print Self-Tie Belted Pants,Plaid,NA
Tartan Bodycon Dress,Plaid,Spaghetti Strap
Frill Trim Knot Front Ruched Bust Ditsy Floral Dress,Ditsy Floral,Straps
Oversized Button Up Shirt Dress Without Belt,Plain,Collar
Tie Front Rib-knit Crop Top,Plain,Sweetheart
Drawstring Waist Cord Tapered Pants,Plain,NA
Asymmetrical Neck Ruched Bust Cut Out Dress,Plain,Asymmetrical Neck
Slant Pocket Button Front A-line Dress,Plain,Round Neck
Drawstring Tie Side Skirt,Plain,NA
Mock Neck Rib-knit Tank Top Without Necklace,Plain,Stand Collar
Strawberry Print Knot Cami Dress,Fruit&Vegetable,Spaghetti Strap
1pc Slogan Graphic Drawstring Waist Sweatpants,Slogan,NA
Plunging Neck Layered Fringe Cami Bodycon Dress,Plain,Spaghetti Strap
Notched Neck Polka Dot Dress,Polka Dot,Notched
Double Button Seam Front Solid Pants,Plain,NA
Wide Waistband Studded Detail PU Leather Shorts,Plain,NA
Single Breasted Rib-knit Solid Tee,Plain,V neck
Plaid Straight Leg Pants,Plaid,NA
Ruched Knot Front Rib-knit Crop Tee,Plain,Sweetheart
Ditsy Floral Cami Dress,Ditsy Floral,Spaghetti Strap
Sweetheart Neck Puff Sleeve Frill Trim Flared Hem Dress,Plain,Sweetheart
One Shoulder Exaggerated Ruffle Trim Self Belted Mermaid Dress,Plain,One Shoulder
Solid Split Back Pencil Skirt,Plain,NA
Allover Print Frill Mock Neck Babydoll Dress,All Over Print,Stand Collar
Wide Waistband Mesh Insert Leggings,Plain,NA
Mock Neck Rib-knit Tee,Plain,Stand Collar
Drop Shoulder Letter Graphic Tee,Letter  Graphic,Round Neck
Buttoned Pleated Hem Solid Skirt,Plain,NA
Checkered Bodycon Dress,Plaid,Spaghetti Strap
Lettuce Trim Rib-knit Crop Cami Top,Plain,Spaghetti Strap
Drawstring Tie Front Crop Top,Zebra Stripe,V neck
Double V-Neck Ditsy Floral Cami Dress,Ditsy Floral,Spaghetti Strap
Mock Neck Letter Embroidered Tee,Letter,Stand Collar
Lettuce Trim Tie Back Colorblock Tee,Colorblock,Round Neck
Solid Crop Halter Top,Plain,Halter
Tie Shoulder Split Hem Houndstooth Suspender Dress,Houndstooth,Spaghetti Strap
Puff Sleeve Ruched Front Ditsy Floral Dress,Ditsy Floral,Sweetheart
Frill Neck Dalmatian Print A-line Dress Without Belted,All Over Print,Stand Collar
Button Detail Wide Leg Pants,Plain,NA
Buttoned Front Floral Crop Tee,Floral,V neck
Puff Sleeve Ruched Front Split Thigh Ditsy Floral Dress,Ditsy Floral,Sweetheart
Houndstooth Gigot Sleeve Dress,Houndstooth,Round Neck
Ruched Rib-knit Tube Bodycon Dress,Plain,Strapless
Drawstring Detail Ditsy Floral Print Skirt,Ditsy Floral,NA
Notch Neck Dolman Sleeve Top,Floral,Notched
Slogan Graphic Tee,Slogan,Round Neck
Tartan Ruched Shirt Dress,Plaid,Collar
Rib-Knit Crop Cami Top,Plain,Spaghetti Strap
Butterfly Print Elastic Waist Sweatpants,Animal,NA
Solid Pocket Detail Belted Skirt,Plain,NA
Turtle Neck Solid Tee,Plain,Funnel Neck
Mock Neck Rib-knit Bodycon Dress,Plain,Stand Collar
Button Fly Patch Pocket Side Pants,Plain,NA
Mock-neck Rib-knit Bodycon Dress,Plain,Stand Collar
Ribbed Mock Neck Tank Top,Plain,Stand Collar
Drawstring Waist Button Front Cargo Dress,Plain,Collar
Floral Print Shirred Back Puff Sleeve Dress,Floral  All Over Print,V neck
Tie Dye Lettuce Trim Cut Out Detail Tee,Tie Dye,Stand Collar
Drawstring Waist Solid Skirt,Plain,NA
Ruched Detail A-line Dress,Plain,Sweetheart
Surplice Neck Split Hem Solid Dress,Plain,V neck
Button Front Allover Print A-line Dress,All Over Print,V neck
Floral Keyhole Tie Front Smock Dress Without Belt,Floral  All Over Print,Tie Neck
Letter Graphic Short Sleeve Tee,Letter,Round Neck
Button Detail Asymmetrical Ruffle Hem Gingham Skirt,Gingham,NA
Chinese Dragon Print Bodycon Dress,Animal,Spaghetti Strap
Lace Up Side Skirt,Plain,NA
Lantern Sleeve Eyelash Lace Trim Belted Dress,Plain,V neck
Cutout V-neck Batwing Sleeve Allover Print Top,All Over Print,Keyhole Neckline
Sweetheart Neck Frill Trim Ruched Top,Plain,Sweetheart
Patch Pocket Solid Blouse,Plain,Collar
Grommet Eyelet Lace Up Suede Skirt,Plain,NA
Bishop Sleeve Crop Blouse,Plain,Deep V Neck
Shirred Flounce Hem Dress,Plain,V neck
Laser Cut Trim Skirt,Plain,NA
High Waist Grid Bodycon Skirt,Plaid,NA
Button Front Belted Striped Dress,Striped,Collar
Ruched Sleeve Curved Hem Shirt Dress Without Belt,Plain,Collar
Scoop Neck Ruched Bust Crop Tee,Plain,Square Neck
Graphic Print Elastic Waist Flare Leg Pants,Tribal,NA
Marled Round Neck Tee,Plain,Round Neck
Frill Trim Waist Butterfly Print Pants,Animal,NA
Notched Neck Ditsy Floral Bodycon Dress,Ditsy Floral,Notched
Plaid High Waist Pencil Skirt,Plaid,NA
Floral & Letter Graphic Tee,Geometric  Floral,Round Neck
Plaid Straight Leg Pants,Plaid,NA
Checkered Print High-Rise Biker Shorts,Plaid,NA
Rolled Cuff Ruffle Hem Top,Plain,Round Neck
Lace Trim Two Tone Self Belted Dress,Colorblock,Round Neck
Tartan High Waist A Line Skirt,Tartan,NA
Sleeveless Slant Pocket Dress,Plain,Round Neck
Knot Waist Marled Sweatpants,Plain,NA
High Waist Zipper Side Plaid Pants,Plaid,NA
Solid Lace-up Shirt Dress,Plain,Collar
Simplee Ruffle Trim Ruched Waist Layered Hem Dress,Plain,Round Neck
Scorpion Print Drawstring Sweatpants,Animal,NA
Tie Waist Letter Tape Side Marled Leggings,Letter,NA
Snakeskin Print Batwing Sleeve Top,Snakeskin Print,Round Neck
Button Up Solid Crop Top,Plain,V neck
Knot Strap Shirred Back Cherry Print Slip Dress,Fruit&Vegetable  All Over Print,Spaghetti Strap
Laser Cut Scalloped Trim Belted Dress,Plain,Round Neck
Mesh Yoke Solid Tee,Plain,Round Neck
Side Stripe Drawstring Waist Sweatpants,Striped,NA
Rib-knit Yin And Yang Embroidered Ringer Cami Top,Graphic,Spaghetti Strap
Confetti Print Split Mini Skirt,All Over Print,NA
SBetro High Waist Solid Straight Pants,Plain,NA
Tie Neck Lantern Sleeve Ditsy Floral Top,Ditsy Floral,Tie Neck
Cold Shoulder Asymmetrical Hem Contrast Stitch Top,NA,Cold Shoulder
Floral Raglan Sleeve Dress,Floral,Round Neck
Cowl Neck Lace Trim Open Back Fishtail Hem Satin Dress,Plain,Spaghetti Strap
Knotted Side Chinese Dragon Print Top,Animal,Round Neck
Solid Bodycon Skirt,Plain,NA
Buttoned Front Solid Shorts,Plain,NA
Skull Print Tee,Halloween,Round Neck
Solid Button Rib-Knit Tank Top,Plain,Scoop Neck
Belted High Waist Wide Leg Pants,Plain,NA
Drop Shoulder Solid Tee Dress,Plain,Round Neck
Simplee Button Front Belted Allover Print Shirt Dress,All Over Print,Collar
Button Half Placket Rib-knit Tee,Plain,Notched
Graphic Print Cami Bodycon Dress,Graphic,Spaghetti Strap
Solid Sleeveless Shoulder Pad Satin Top,Plain,Round Neck
Tie Back Floral Print Dress,Floral  All Over Print,Halter
50s Sweetheart Knot Back Floral Flare Dress,Floral,Sweetheart
Cold Shoulder Flounce Foldover Floral Dress,Floral,Spaghetti Strap  Cold Shoulder
Pearls Beaded Crop Top,Plain,Deep V Neck
Button Front Lace Trim Cami Top,Plain,Spaghetti Strap
Floral Print Belted Ruffle Neck Dress,Floral  All Over Print,Round Neck
Eyelash Lace Trim Ribbon Bow Detail Shirred Cuff Mesh Overlay Floral Dress,Floral,Round Neck
Angel & Letter Graphic Tee,Letter  Figure,Round Neck
Rib-knit Crop Halter Top,Plain,Halter
Ditsy Floral Print Lace Up Bell Sleeve Dress,Ditsy Floral,Deep V Neck
Plunging Twist Front Velvet Dress,Plain,Deep V Neck
Elastic Waist Space Dye Biker Shorts,Plain,NA
Solid Suspender Skirt,Plain,NA
High Waist Floral Print Skinny Pants,Floral,NA
Cartoon Graphic Biker Shorts,Cartoon  Graphic,NA
Satin Panel One Shoulder Solid Dress With Transparent Strap,Plain,One Shoulder
SBetro Guipure Lace Bodice Flocked Mesh Dress,Polka Dot,Stand Collar
Joyfunear Surplice Neck Lantern Sleeve Ruffle Hem Polka Dot Dress,Polka Dot,V neck
Lettuce Trim Rib-knit Bodycon Dress,Plain,Spaghetti Strap
Button Front Patch Pocket Cord Skirt,Plain,NA
Off Shoulder Frill Swiss Dot Mesh Sleeve Shirred Peplum Top,Plain,Off the Shoulder
X Drop Shoulder Letter & Graphic Print Tee,Letter  Graphic,Round Neck
Vertical Striped Tailored Pants,Striped,NA
Camo Print High-Rise Drawstring Joggers,Camo,NA
High Waist Drawstring Ruched Skirt,Plain,NA
Notched Neck Rib-knit Lettuce Hem Bodycon Dress,Plain,Notched
Criss Cross High Waist Leggings,Plain,NA
Wide Waistband Capri Leggings,Plain,NA
Solid Drawstring Front Batwing Sleeve Tee,Plain,V neck
All Over Print Wide Band Waist Leggings,All Over Print,NA
Criss Cross Back Crop Tank Top,Plain,Deep V Neck
V Neck Lettuce Trim Crop Tee,Plain,V neck
Frilled Neck Lace Trim Exaggerate Bell Sleeve Split Hem Dress,Plain,Stand Collar
Corduroy Floral V-neck Overall Dress,Floral  All Over Print,V neck
Simplee Ruffle Trim Layered Schiffy Dress,Plain,Round Neck
Single Breasted Rib-knit Bodycon Dress,Plain,Scoop Neck
Ribbed Turtleneck Form-Fitting Top,Plain,High Neck
Rusttydustty Fringe Tie Neck Shirred Waist Floral Embroidery Polka Dot Dress,Polka Dot,Tie Neck
Twist Backless Drop Shoulder Tee,Plain,Round Neck
Mixed Animal Scarf Fitted Tee,Animal,Stand Collar
Mock Neck Cut Out Rib-knit Bodycon Dress,Plain,Stand Collar
Wide Waistband Plaid Leggings,Plaid,NA
Sweetheart Neck Crop Bustier Mesh Top,Plain,Sweetheart
Press Button Front Tee,Plain,Scoop Neck
Criss Cross Back Split Hem Dress,Plain,Spaghetti Strap
Letter and Graphic Print Bodycon Dress,Letter  Graphic,Round Neck
Double Crazy High Waist Wide Leg Pants,Plain,NA
Gingham Wide Waistband Leggings,Gingham,NA
Dinosaur Print Tank Top,Animal,Square Neck
V-neck Lantern Sleeve Satin Top,Plain,V neck
Butterfly And Sun Print Crop Tee,Floral  Animal,Round Neck
Elastic Waist PU Leather Mini Skirt,Plain,NA
Solid Drawstring Track Shorts,Plain,NA
Corduroy Wide Leg Pants,Plain,NA
Lettuce Trim Waffle Knit Crop Cami Top,Plain,Spaghetti Strap
High Waist Pocket Side Pants,Plain,NA
Floral Print Bell Sleeve Tie Side Wrap Top,Floral,Deep V Neck
Knot Shoulder Split Hem Tartan Overall Dress,Tartan,Spaghetti Strap
