Name,Pattern Type,Neckline
Lettuce Trim Rib-knit Tie Dye Top,Tie Dye,Scoop Neck
Slant Pocket Solid Skirt,Plain,NA
Contrast Binding Tie Dye Shorts,Tie Dye,NA
Square Neck Plaid Dress,Plaid,Square Neck
Pinstriped Mid-Rise Dolphin Shorts,Striped,NA
Solid Rib-knit Bodycon Dress,Plain,Stand Collar
Frill Trim Buttoned Front Cuffed Shorts,Plain,NA
Lace Up Knot PU Leather Skirt,Plain,NA
Tie Shoulder Ruched Bust Dot Print Dress,All Over Print,Spaghetti Strap
Off Shoulder Ruched Crop Top,Plain,Off the Shoulder
High Waist Ruched PU Leather Pants,Plain,NA
Seam Detail Solid Bodycon Dress,Plain,Round Neck
Solid Button Front Shirt Dress,Plain,Collar
Wide Waistband Criss-cross Back Leggings,Plain,NA
Tie Dye Elastic Waist Sweatpants,Tie Dye,NA
Tie Dye Split Cured Hem Slip Dress,Tie Dye,Spaghetti Strap
Floral Print Cami Top,Floral,Spaghetti Strap
Leopard Cami Bodycon Dress,Leopard,Spaghetti Strap
Paper Bag Waist PU Leather Skirt,Plain,NA
Allover Heart Print Flared Skirt,Heart  All Over Print,NA
Rhinestone Velvet Shorts,Geometric,NA
Draped Front Lantern Sleeve Top,Plain,High Neck
Cowl Neck Tie Back Bandana Top,Plain,Cowl Neck  Halter
SBetro Drawstring Ruched Crisscross Back Satin Cami Bodycon Dress,Plain,Spaghetti Strap
Square Neck Lettuce Trim Gingham Dress,Gingham,Square Neck
High Low Hem Stripe Belted Tunic Top,Striped,Collar
Notched Neck Crop Camo Top,Camo,Notched
Solid Elastic Waist Shorts,Plain,NA
Pleated Mini Skirt,Plain,NA
BASICS Solid Bodycon Dress,Plain,Spaghetti Strap
Flare Bottom Suede Pants,Plain,NA
M-slit Hem Velvet Slip Dress,Plain,Spaghetti Strap
Buckled Belted Mermaid Hem Skirt,Floral,NA
Drop Shoulder Tartan Blouse,Tartan,Collar
Ruffle Trim Square Neck Ditsy Floral Print Dress,Ditsy Floral,Square Neck
Abstract Print Bishop Sleeve Buttoned Shirt,All Over Print,Stand Collar
Ruffle Hem Waffle Knit Cami Top,Plain,Spaghetti Strap
Ruched Detail Bodycon Slip Dress,Plain,Spaghetti Strap
Ribbed Solid Bodycon Dress,Plain,Spaghetti Strap
Wide Band Waist Pocket Back Leggings,Plain,NA
Drawstring Waist Quilted Joggers,Plain,NA
Mock-neck Solid Fitted Tee,Plain,Stand Collar
Floral Print Tunic Dress,Floral,Round Neck
Graphic Print Crop Cami Top,Letter  Tropical,Spaghetti Strap
Letter Graphic Split Hem Halter Bodycon Dress,Letter,Halter
Drawstring Pocket Corduroy Carrot Pants,Plain,NA
High Waist Slant Pocket Cord Pants,Plain,NA
Plaid Lettuce Trim Cami Bodycon Dress,Plaid,Spaghetti Strap
Fold Pleated Front Flap Front Buttoned Hem Tailored Pants,Striped,NA
Buttoned Front Crop Top,Plain,V neck
Split Thigh Solid Bodycon Dress,Plain,Round Neck
Asymmetrical Neck Hidden Pockets Tee Dress,Plain,Asymmetrical Neck
Corduroy Zipper Front Mini Skirt,Plain,NA
Leopard One Shoulder Crop Top,Leopard,One Shoulder
Slant Pocket Self Belted Shorts,Plain,NA
Tribal Print Shirred Waist Backless Cami Dress,Tribal,Deep V Neck  Spaghetti Strap
Colorblock High-Rise Joggers,Colorblock,NA
Mock-Neck Lettuce Trim Rib-knit Dress,Plain,Stand Collar
Striped Side Flare Leg Pants,Striped,NA
Angel Print Lettuce Trim Tee,Figure,Round Neck
Surplice Neck Rib-knit Crop Tee,Plain,Deep V Neck
Missord Lantern Sleeve Satin Bustier Skater Dress,Plain,Sweetheart
Zip Back High Waist Solid Skirt,Plain,NA
Gigot Sleeve Ruched Allover Floral Mesh Dress,Floral  All Over Print,Square Neck
Ditsy Floral Open-Back Mock Wrap Dress,Ditsy Floral,Spaghetti Strap
Rib-knit Crop Slim Tee,Plain,Collar
Letter and Car Print Tie Dye Tee Dress,Letter  Tie Dye,Round Neck
Metallic Plunging High-Slit Mini Dress,Plain,Halter  Cowl Neck
Chain Detail Backless Bodycon Dress,Plain,Halter
Allover Dalmatian Print Shirred Detail Dress,All Over Print,Stand Collar
Letter and Fire Print Tee,Letter  Fire,Round Neck
Solid Rib-knit Tube Dress,Plain,Strapless
Knot Strap Plaid Bodycon Dress,Plaid,Spaghetti Strap
Drop Shoulder Crop Solid Tee,Plain,Round Neck
V-neck Self Belted Dress,Plain,V neck
Drawstring Waist Pocket Side Pants,Plain,NA
Marble Print Bodycon Skirt,Marble,NA
Tie Front Ruffle Hem Shorts,Plain,NA
Floral Print Batwing Sleeve Blouse,Floral,Round Neck
Tribal Print Split Thigh Fringe Detail Skirt,Geometric  Tribal,NA
Solid Cami Top,Plain,Spaghetti Strap
Lettuce Trim Flounce Sleeve Tee,Plain,Stand Collar
Button Front Bell Sleeve Shirred Tight Hem Plaid Top,Plaid,V neck
Split Hem Tartan Bodycon Dress,Tartan,Spaghetti Strap
Solid Button Fly Tailored Pants,Plain,NA
Drawstring Waist Colorblock Joggers,Colorblock,NA
Slogan Graphic Crop Tank Top,Slogan,Round Neck
Floral Cold Shoulder Top,Floral,Cold Shoulder
Double V-Neck Snakeskin Print Cami Top,Snakeskin Print,Spaghetti Strap
Plaid Straight Leg Pants,Plaid,NA
Striped Bodycon Skirt,Striped,NA
Solid Crop Halter Top,Plain,Halter
High Waist Tartan Pleated Skirt,Tartan,NA
Solid Rib-knit Tank Top,Plain,Round Neck
High Waist Striped Pants,Striped,NA
Allover Heart Print Surplice Front Dress,Heart  All Over Print,V neck
Slit Hem PU Leather Bodycon Dress,Plain,Halter
V-collar Rib-knit 2 In 1 Dress,Colorblock,Collar
Tropical Print Bodycon Cami Dress,Tropical,Spaghetti Strap
Tie Dye Backless Halter Dress,Tie Dye,Halter
BASICS Wide Waistband Rib-knit Biker Shorts,Plain,NA
Plunging Neck Shoulder Pad Ruched Dress,Plain,Deep V Neck
Solid Rib-knit Biker Shorts,Plain,NA
Cross Wrap Front Tie Back Halter Top,Plain,Spaghetti Strap
Bardot Frill Trim Belted Polka Dot Dress,Polka Dot,Off the Shoulder
Rib-knit Solid Tee,Plain,Round Neck
Layered Hem Gingham Cami Top,Gingham,Spaghetti Strap
Mesh Insert Leggings,Plain,NA
Cut and Sew Stitch Trim Crop Tee,Colorblock,Round Neck
Floral Print Shirred A-line Dress,Floral  All Over Print,Square Neck
Ditsy Floral Contrast Lace Cami Top,Ditsy Floral,Spaghetti Strap
Corduroy Button Front Flared Skirt,Plain,NA
High Waist Textured Biker Shorts,Plain,NA
Zip Half Placket Rib-knit Tee,Plain,Stand Collar
Allover Print Ruched Ruffle Hem Dress,All Over Print,V neck
Drawstring Side Solid Tee,Plain,Round Neck
Lace Crop Bralette Top,Plain,Spaghetti Strap
Off Shoulder Ruffle Mesh Dress,Plain,Off the Shoulder
Double Zip PU Leather Mini Bodycon Skirt,Plain,NA
Solid Slant Pocket Corduroy Pants,Plain,NA
Plaid Print Button Front Overshirt,Plaid,Collar
Draped Front Ruched Velvet Skirt,Plain,NA
Elastic Waist Plaid Pants,Plaid,NA
Lettuce Trim Rib-knit Tie Dye Top,Tie Dye,Square Neck
Cutout Drop Shoulder Bodycon Dress,Plain,Round Neck
BASICS Wide Waistband Biker Shorts,Plain,NA
Drawstring Waist Patch Pocket Side Joggers,Plain,NA
Eyelet Lace Up Tie Back Bustier Bandeau Crop Top,Plain,Strapless
Plaid Print Flare Skirt,Plaid,NA
Glen Plaid Belted Paperbag Skinny Pants,Plaid,NA
Glamaker Off Shoulder Ruched Dress,Plain,Off the Shoulder
Split Hem Tartan Flare Leg Pants,Tartan,NA
Solid Split Front Skort,Plain,NA
Hollow Out Tropical Print Belted Dress,Tropical,V neck
Ribbed Turtleneck Drop Shoulder Tee,Plain,High Neck
High Waist Tartan Pleated Skirt,Plaid,NA
Sheer Polka-dot Mesh Sleeve Velvet Dress,Plain,Stand Collar
Elastic Waist Floral Print Pencil Skirt,Floral,NA
Eyelash Lace Hem Floral Skirt,Floral,NA
Ditsy Floral Contrast Lace Cami Top,Ditsy Floral,Spaghetti Strap
Metallic Coated Leggings,Plain,NA
Square Neck Seam Front Tank Top,NA,Square Neck
Gigot Sleeve Big Bow Wrap Fitted Dress,Plain,V neck
Joyfunear One Shoulder Draped Ruched Mesh Bodycon Dress,Plain,One Shoulder
Color Block Lantern Sleeve Dress Without Bag,Colorblock,Stand Collar
Racerback Solid Tank Top,Plain,Round Neck
Knot Strap Plaid Dress,Plaid,Spaghetti Strap
Split Front Drawstring Ruched Front Skirt,Plain,NA
Zipper Side Split Hem Cord Skirt,Plain,NA
Twist Backless Drop Shoulder Tee,Plain,Scoop Neck
Lace-up Front Floral Jacquard Cami Top,Floral  All Over Print,Spaghetti Strap
Sollinarry Paperbag Waist Fold Pleat Shorts,Plain,NA
Swiss Dot Ruched Bust Crop Blouse,Plain,Sweetheart
Paperbag Waist Belted Striped Pants,Striped,NA
Eilly Bazar Zip Back Fringe Trim Suede Skirt,NA,NA
Striped Tape Side Elastic Waist Leggings,NA,NA
Solid Drawstring Waist Harem Pants,Plain,NA
V-neck Allover Print Smock Dress,All Over Print,V neck
Ditsy Floral Half Button Ruffle Hem Dress,Ditsy Floral,Stand Collar
Rib-knit Crop Tank Top,Plain,Square Neck
Zip Side Solid Pleated Skirt,Plain,NA
O-ring Zip Up PU Leather Asymmetrical Hem Cami Dress,Plain,Spaghetti Strap
BASICS Solid Sleeveless Bodycon Dress,Plain,Scoop Neck
Tie Dye High Waist Legging Shorts,Tie Dye,NA
Dinosaur Print Tee,Cartoon,Round Neck
Double Crazy Plunging Neck Ruched Detail Satin Slip Dress,Plain,Deep V Neck  Spaghetti Strap
Flocked Polka Dot Mesh Lantern Sleeve Bodycon Dress,Polka Dot,Stand Collar
Scoop Neck Rib-knit Crop Tee,Plain,Scoop Neck
Cheetah Print Tiered Layer Skirt,All Over Print,NA
Flap Pocket High Low Hem Shirt Dress,Plain,Collar
Slogan Graphic Marled Leggings,Letter  Slogan,NA
Cut Out Side Solid Leggings,Plain,NA
Cross Wrap Striped Bodycon Skirt,Striped,NA
Belted Strap PU Mixed Media Pants,Plain,NA
Slant Pocket Drawstring Shorts,Plain,NA
Sweetheart Neck Sheer Bustier Crop Top,Plain,Sweetheart
Rhinestone Lace Up Front Contrast Stitch Colorblock Tank Top,Colorblock,Scoop Neck
Letter Graphic Biker Shorts,Letter,NA
Ruffle Hem Gingham Smock Dress,Gingham,Round Neck
Cow Print Dress,Animal,Scoop Neck
High Waist Sheer Lace Biker Shorts Without Panty,Plain,NA
O-zip Fly Corduroy Skinny Pants,Plain,NA
Cut Out Side Bodycon Dress,Plain,Round Neck
Zip Side Contrast Lace Corduroy Skirt,Colorblock,NA
X WEJDENE Mock Neck Puff Sleeve Colorblock Dress,Colorblock,Stand Collar
Slant Pocket PU Leather Pants,Plain,NA
Skull & Moon Print Tee,Halloween,Round Neck
Mock-Neck Plaid Form Fitted Dress,Plaid,Stand Collar
Missord Plunging Neck Belted Prom Dress,Plain,Deep V Neck
Shoulder Pad Solid Top,Plain,Round Neck
Daisy Floral Wide Leg Pants,Ditsy Floral,NA
Lettuce Trim Bodycon Dress,Plain,Spaghetti Strap
Lantern Sleeve Cable Knit Dress,Plain,Round Neck
Plunging Neck Batwing Sleeve Dress,Tribal,V neck
Elastic Waist Heathered Gray Shorts,Plain,NA
Button Up Crop Top,Plain,V neck
Twist Back Drop Shoulder Tee,Plain,Round Neck
BASICS Drawstring Waist Slant Pocket Solid Fleece Joggers,Plain,NA
Ditsy Floral Surplice Front Babydoll Blouse,Ditsy Floral,V neck
O-ring Zip Half Placket Crop Slim Top,Plain,Stand Collar
Floral Print Flounce Sleeve A-line Dress,Floral  All Over Print,Sweetheart
Twist Backless Drop Shoulder Tee,Plain,Scoop Neck
Tie Dye Panel Seam Front Crop Tee,Tie Dye,Round Neck
Stepped Side Zip Back Suede Skirt,Plain,NA
BASICS Solid Wide Waistband Leggings,Plain,NA
Letter & Butterfly Graphic Longline Tee,Letter  Animal,Round Neck
Solid High Waist Tapered Pants,Plain,NA
Ribbed Long Sleeve Semi-Cropped Tee,Plain,Round Neck
Short Sleeve Solid Tee Dress,Plain,Round Neck
Flap Pocket Buckle Straight Skirt,Plain,NA
Letter Tape Detail Zip Half Placket Bodycon Dress,Letter,Collar
Eilly Bazar Sheer Mesh Lantern Sleeve Bodycon Dress,Plain,Off the Shoulder
Split Side Seam Back Shorts,Plain,NA
High Waist Plaid Pants,Plaid,NA
Frilled Strap Tie Front Ruched Bust Ditsy Floral Dress,Ditsy Floral,Spaghetti Strap
Paperbag Waist Belted PU Leather Pants,Plain,NA
Joyfunear Off Shoulder Split Bell Sleeve Dress,Plain,Off the Shoulder
Cut Out Twist Crocodile Embossed Skirt,Crocodile,NA
BASICS Solid V Neck Cami Top,Plain,Spaghetti Strap  V neck
Lace Trim Bodycon Dress,Plain,Spaghetti Strap
BASICS Off Shoulder Form Fitted Solid Dress,Plain,Strapless
Scoop Neck Lace Panel Slim Tee,Plain,Scoop Neck
Flap Pocket Side Solid Pants,Plain,NA
ANGEL FASHIONS Cold Shoulder Split Thigh Prom Dress,Plain,Cold Shoulder
Crisscross Front Peekaboo Ruched Back Dress,Plain,Spaghetti Strap
Elastic Waist Slant Pocket Solid Shorts,Plain,NA
Plunging Neck Knot Front Ditsy Floral Dress,Ditsy Floral,Deep V Neck
Ruffle Trim Fishtail Hem Dress,Plain,Round Neck
Split Hem Zipper Back Corduroy Skirt,Plain,NA
Low Back Ditsy Floral Cami Dress,Ditsy Floral,Spaghetti Strap
Allover Plants Print Layered Bell Sleeve Top,Plants  All Over Print,Round Neck
Contrast Dobby Mesh Sleeve Shirred Frill Top,Polka Dot,Square Neck
Cartoon And Slogan Graphic Tee,Cartoon  Slogan,Round Neck
Drop Shoulder Crop Tee,Plain,Round Neck
All Over Print High Waist Flare Leg Pants,All Over Print,NA
Solid Ruched Mini Skirt,Plain,NA
Double Crazy Wrap Detail Velvet Prom Dress,Plain,Spaghetti Strap
Abstract Art Print Biker Shorts,All Over Print,NA
Ruched Split High Tube Dress,Plain,Strapless
Leaf & Geo Print Raglan Sleeve Waffle Knit Tee,Geometric  Colorblock,V neck
Scallop Square Neck Hanky Ruffle Hem Tee,Plain,Square Neck
Cable Knit Crop Cami Top,Plain,Spaghetti Strap
Paperbag Waist Knot Detail Shorts,Plain,NA
Tie Front Ruched Hem Sweatpants,Plain,NA
Button Front Cord Pants,Plain,NA
Allover Heart Print Flare Leg Pants,Heart  All Over Print,NA
Notch Waist Fold Pleated Front Tailored Pants,Plain,NA
Solid Pocket Detail Tee Dress,Plain,Round Neck
Paperbag Waist Knot Detail Seam Front Pants,Plain,NA
Contrast Leopard Panel Mesh Insert Leggings,Leopard,NA
Plant Print Button Front Smock Dress,Plants,V neck
Mock Neck Cut-out Rib-knit Slim Crop Tee,Plain,Stand Collar
Floral and Tribal Print Flare Leg Pants,Floral  Tribal,NA
Slogan Graphic Crew Neck Tee,Slogan,Round Neck
Elastic Waist Tartan Skirt,Tartan,NA
V Neck Solid Fitted Crop Tee,Plain,V neck
Solid Rib-knit Wide Leg Pants,Plain,NA
Leopard And Heart Print Tee,Heart  Leopard,Round Neck
Elastic Waist Split Hem Velvet Skirt,Plain,NA
Split Hem Rib-knit Tank Top,Plain,Collar
Square Neck Split Thigh Allover Floral Print Dress,Floral,Scoop Neck
Tie Back Drawstring Ruched Pants,Plain,NA
Swiss Dot V-neck Flounce Sleeve Chiffon Blouse,Plain,V neck
Double Crazy Tie Back Velvet Cami Dress,Plain,Spaghetti Strap
Solid Pleated Cord Skirt,Plain,NA
Solid High Waist Pleated Satin Skirt,Plain,NA
Mock Neck Rib-knit Tee,Plain,Stand Collar
Drop Shoulder Letter and Car Print Top,Letter  Graphic,Round Neck
Shirred Mock Neck Allover Print Ruffle Hem Dress,All Over Print,Stand Collar
Cuffed Cord Shorts,Plain,NA
Solid Bandana Halter Top,Plain,Halter
Floral Print Joggers,Animal,NA
One Shoulder Ruched Bodycon Dress,Plain,One Shoulder
Sweetheart Neck Dot Mesh Skater Dress,Plain,Collar  Sweetheart  Keyhole Neckline
Letter Graphic Colorblock Bishop Sleeve Dress,Letter  Colorblock,Funnel Neck
Lantern Sleeve Shirred Waist Dress,Plain,Stand Collar
Zipper Side Velvet Pleated Skirt,Plain,NA
Letter Graphic Drop Shoulder Tee,Letter,Round Neck
Mock-Neck Split Back Camo Dress,Camo,Stand Collar
Ruched Drawstring Knot Rib-knit Crop Top,Plain,Strapless
Split Hem Solid Leggings,Plain,NA
Mesh Insert Solid Cycling Shorts,Plain,NA
Drawstring Side Tie Dye Bodycon Dress,Tie Dye,Round Neck
Split Hem Solid Bodycon Dress,Plain,Round Neck
Floral Self-Tie Braided Cami Dress,Floral,Spaghetti Strap
Tie Back Bell Sleeve Ruffle Hem Dress,Plain,Deep V Neck
Slant Pocket Textured Joggers,Plain,NA
PU Leather Straight Leg Pants,Plain,NA
Glitter Contrast Mesh Fringe Detail Prom Dress,Plain,Round Neck
Plaid Off Shoulder Slit Hem Dress,Plaid,Off the Shoulder
Slogan Graphic Wide Band Waist Leggings,Slogan,NA
Leg-of-mutton Sleeve Tie Back Split Hem Dress,Plain,Round Neck
Cold Shoulder Waffle Knit Tee,Plain,Cold Shoulder
Sheer Mesh Insert Satin Top,Plain,V neck
Solid Flared Midi Skirt,Plain,NA
Asymmetrical Hem Contrast Stitch Colorblock Dress,Colorblock,Asymmetrical Neck
Watermelon & Slogan Graphic Tee,Fruit&Vegetable  Slogan,Round Neck
Lace Up Backless Solid Dress,Plain,Spaghetti Strap
Solid High Waist Sweatpants,Plain,NA
Split Thigh Floral Skirt,Floral,NA
Contrast Lace Mesh Overlay Pleated Skirt,Colorblock,NA
Letter Embroidered Crop Tee,Letter,Round Neck
Mock Neck Cut-out Rib-knit Slim Crop Tee,Plain,Stand Collar
Crisscross Tie Back Crop Bralette Top,Plain,Spaghetti Strap
Cowl Neck Tie Back Bandana Velvet Halter Top,Plain,Halter
Lace-up Back Ruched Bust Crop Cami Top,Plain,Spaghetti Strap
Mock Neck Shirred Waist Floral Print Maxi Dress,Floral,Stand Collar
Solid Satin Cami Top,Plain,Spaghetti Strap
Two Tone Surplice Neck Tee,Colorblock,V neck
Paperbag Waist Belted Tropical Print Skirt,Tropical,NA
Tie Front Paperbag Waist Plaid Skinny Pants,Plaid,NA
Ruffle Hem Swiss Dot Belted Dress,Plain,Round Neck
Sun & Letter Graphic Oversized Tee,Letter  Graphic,Round Neck
Snakeskin Print Biker Leggings,Snakeskin Print,NA
Split Hem Corduroy Mini Skirt,Plain,NA
Ring Detail Asymmetrical Hem Tank Top,Plain,Round Neck
Drawstring Waist Cord Tapered Pants,Plain,NA
Floral & Fruit Print Cami Top,Floral  Fruit&Vegetable,Spaghetti Strap
Solid Rib-knit Crop Top,Plain,Round Neck
Crop Tied Halter Top,Plain,Halter
Solid Ruffle Trim Belted Flare Dress,Plain,Round Neck
Solid Drawstring Side Shirt Dress,Plain,Collar
Buttoned Front Rib-knit Dress,Plain,Scoop Neck
High Waist Tartan Wide Leg Pants,Tartan,NA
Color Block Elastic Waist Sweatpants,Colorblock,NA
Pinstriped High-Rise High Slit Pants,Striped,NA
Tie Front Ditsy Floral Crop Milkmaid Top,Plain,Sweetheart
Swiss Dot Lace Panel Blouse,Plain,Deep V Neck
Frill Trim Shirred Gingham Cami Peplum Top,Gingham,Spaghetti Strap
Glitter Surplice Neck Bodycon Dress,Plain,Deep V Neck
Mock Neck Tied Backless Zebra Stripe Crop Tee,Zebra Stripe,Stand Collar
Letter & Butterfly Graphic Longline Tee,Letter  Animal,Round Neck
Drop Shoulder Snakeskin Print Tee,Snakeskin Print,Round Neck
Striped Pencil Tank Dress,Striped,Scoop Neck
Houndstooth Button Detail Slit Hem Tweed Skirt,Houndstooth,NA
Polka Dot Frill Neck Pleated Belted Dress,Polka Dot,Stand Collar
Zipper Back Solid Flare Dress,Plain,Round Neck
Raglan Sleeve Letter and Angel Print Crop Top,Letter  Figure,Round Neck
Keyhole Neck Batwing Sleeve Floral Print Top,Floral,Keyhole Neckline
Button Up Lettuce Edge Top,Plain,Scoop Neck
Solid Drawstring Waist Sweatpants,Plain,NA
Rib-knit Crop Cami Top,Plain,Spaghetti Strap
Solid Fitted Crop Top,Plain,Round Neck
All Over Floral Print Ruffle Hem Velvet Dress,Floral  All Over Print,Stand Collar
Double V-Neck Rib-knit Top,Plain,V neck
Gingham Flared Skirt,Gingham,NA
Fringe Hem Tweed Skirt,Plaid,NA
Chinese Dragon Print Crop Tank Top,Animal  All Over Print,Straps
Shirred Neck and Cuff Polka Dot Dress,Polka Dot,Stand Collar
Argyle Print Long Sleeve Fitted Mini Dress,Geometric,Round Neck
Plaid High Waist Pencil Skirt,Plaid,NA
Flower Print Shell Dress,Floral,Round Neck
Stand Collar Ruched Hem Rib-knit Bodycon Dress,Plain,Stand Collar
Flap Pocket Buckle Detail Pants,Plain,NA
Batwing Sleeve Wrap Knotted Floral Dress,Floral,V neck
Flap Pocket Back Wide Leg Cord Pants,Plain,NA
Lace Trim Rib-knit Cami Top,Plain,Spaghetti Strap
Solid Elastic Waist Teddy Pants,Plain,NA
One Shoulder Crop Tee,Plain,One Shoulder
Plaid Pleated Mini Skater Skirt,Tartan,NA
Double V Neck Scallop Edge Dress,Plain,V neck
Leopard Print Side Split Skirt,Leopard,NA
Tie Dye Print Knot Waist Sweatpants,Tie Dye,NA
Split Hem Zip Back PU Skirt,Plain,NA
Plaid High Waist Pleated Skirt,Plaid,NA
One Shoulder Floral Print Top,Floral  All Over Print,One Shoulder
Elastic Waist Lettuce Trim Textured Leggings,Plain,NA
Contrast Lace Crop Cami Top,Plain,Spaghetti Strap
Ditsy Floral Surplice Front Knot Dress,Ditsy Floral,V neck
Buckle Strap Pleated Skirt,Plain,NA
Contrast Schiffy Patchwork Tunic Dress,Colorblock  Patchwork,Round Neck
Knotted Shoulder Ruched Bust Ditsy Floral Cami Dress,Ditsy Floral,Spaghetti Strap
Rib Knit knot Front Wide-leg Pants,Plain,NA
Glen Plaid High Waist Cropped Pants,Plaid,NA
Keyhole Back Lantern Sleeve Colorblock Top,All Over Print,Round Neck
Leopard Print Boat Neck Long Sleeve Tee,Leopard,Scoop Neck
Rib-knit Crop Tank Top,Plain,Round Neck
Rib-knit High Waist Flare Leg Pants,Plain,NA
Lettuce Trim Allover Heart Bodycon Dress,Heart  All Over Print,Spaghetti Strap
Overlap Waist Striped Detail Leggings,Striped,NA
Round Neck Solid Bodycon Dress,Plain,Round Neck
Overlap Waist Solid Leggings,Plain,NA
Corduroy High-Rise Mini Skirt,Plain,NA
Marble Knit Form-Fitting Henley Tee,Plain,Scoop Neck
Funnel Neck Drop Shoulder Pigeon & Letter Print Dress,Letter  Graphic,Funnel Neck
V-neck Polka Dot Ruffle Hem Dress,Polka Dot,V neck
Graphic Print Short Sleeve Tee,Graphic,Round Neck
Off Shoulder Lace Up Front Ruched Mesh Dress,Plain,Off the Shoulder
Letter Graphic Bodycon Dress,Letter,Round Neck
Cross Back High Split Satin Maxi Slip Dress,Plain,Deep V Neck  Spaghetti Strap
BASICS Solid High Neck Tee,Plain,High Neck
Drop Shoulder Striped Dress,Striped,Round Neck
Pleated Tartan Mini Skirt,Tartan,NA
Double Pocket Shirred Back Cami Dress,Plain,Spaghetti Strap
Batwing Sleeve Floral Print Tunic Dress,Floral,Round Neck
Split Hem Plaid Dress,Plaid,Spaghetti Strap
Notched Neck Rib-knit Crop Tank Top,Plain,Notched
Lettuce Trim Scoop Neck Tee,Tie Dye,Scoop Neck
BASICS One Shoulder Bodycon Dress,Plain,One Shoulder
Galaxy Print Contrast Mesh Mini Skirt,Galaxy,NA
Rusttydustty Flounce Hem Floral Print Skirt,Floral  Paisley,NA
Floral Print Wide Leg Pants,Floral,NA
Swiss Dot Lace Panel Blouse,Plain,Deep V Neck
Sweetheart Neck Bodycon Dress,Plain,Sweetheart
High Waist Plaid leggings,Plaid,NA
Elastic Waist Rib-knit Marled Flare Leg Pants,Plain,NA
Ditsy Floral Smocked Puff Sleeves Mini Dress,Ditsy Floral,Sweetheart
Lettuce Trim Knot Front Rib-knit Tee,Plain,V neck
Snakeskin Print Bodycon Dress,Snakeskin Print,Spaghetti Strap
Puff Sleeve Drawstring Knot Front Top,Plain,Sweetheart
Ruched Bust Lantern Sleeve Swiss Dot Dress,Plain,Square Neck
Lettuce Trim Rib-knit Colorblock Crop Tee,Colorblock,V neck
Single Breasted Patch Pocket Tartan Blouse,Tartan,Collar
Fold Pleated Solid Shorts,Plain,NA
Button Front Rib-knit Tee,Plain,V neck
Flounce Hem Solid Dress,Plain,Round Neck
Ribbed Button-Front Long Sleeve Crop Top,Plain,Scoop Neck
Marled Knit High Waist Pants,Plain,NA
V-neck Lace Detail Bell Sleeve Tee,Plain,V neck
Baroque Print Pleated Maxi Skirt,Baroque,NA
Wide Waistband Contrast Stitch Slant Pocket Leggings,Plain,NA
Drop Shoulder Colorblock Tee Dress,Colorblock,Round Neck
Surplice Neck Self Belted Allover Print Dress,All Over Print,Spaghetti Strap
Solid Slim Crop Cami Top,Plain,Spaghetti Strap
Tie Front Allover Print Peplum Top,All Over Print,V neck
Allover Floral Guipure Lace Trim Dress,Floral  All Over Print,V neck
Mock Neck Pleated Hem Solid Velvet Dress,Plain,Stand Collar
Scoop Neck Maxi Dress,Plain,Round Neck
Lace Up Neckline Lantern Sleeve Leopard Top,Leopard,V neck
Pocket Detail Sweatpants,Plain,NA
Chinese Character & Dragon Print Tee,Letter  Animal,Round Neck
Form Fitting Slit Hem Cami Dress,Plain,Spaghetti Strap
Chinese Dragon & Butterfly Print Oversized Tee,Animal,Round Neck
Wide Waistband Solid Skinny Skirt,Plain,NA
Eilly Bazar Solid Leather Look Skinny Pants,Plain,NA
BASICS Solid Boat Neck Bodycon Dress,Plain,Boat Neck
Plunging Neck Gigot Sleeve Ruched Detail Dalmatian Dress,All Over Print,V neck
Simplee Allover Print Ruffle Hem Knot Waist Dress,Floral,V neck
Glamaker Off Shoulder Lace Up Back Rib-knit Bodycon Dress,Plain,Off the Shoulder
Solid Form Fitted Tee,Plain,Round Neck
PU Solid Crop Skinny Pants,Plain,NA
Color Block Stitch Trim Tank Top,Colorblock,Round Neck
Cut And Sew Lace Trimed Tee,Colorblock,Round Neck
Ditsy Floral Print Ruched Dress,Ditsy Floral,Round Neck
Stitch Trim Biker Shorts,NA,NA
MOTF PREMIUM SPANDEX CROPPED TAILORED PANTS,Plaid,NA
Form Fitted Solid Tee,Plain,Round Neck
Two Tone Popper Button Tee,Colorblock,V neck
Plaid Pinafore Dress,Plaid,Straps
Elastic Waist Ruffle Hem Skirt,Plain,NA
Butterfly And Sun Print Crop Tee,Floral  Animal,Round Neck
Rib-knit Crop Tank Top,Plain,Round Neck
Colorblock High-Rise Joggers,Colorblock,NA
Guipure Lace Accordion Pleated Midi Dress,Plain,Round Neck
Scalloped Hem Guipure Lace Bodycon Dress,Plain,Round Neck
Figure Print Mesh Ruched Pencil Skirt,Figure,NA
Cow Print High Waist Sweatpants,Animal,NA
Asymmetrical Neck Cut-out Leopard Colorblock Tee,Colorblock  Leopard,Asymmetrical Neck
Backless Self-Tie Crop Top & Thigh Slit Skirt Set,Plain,Stand Collar
Solid Drawstring Ruched Slim Tee,Plain,Round Neck
Contrast Stitch Colorblock Crop Top,Colorblock,Stand Collar
Solid Rib-knit Flare Leg Pants,Plain,NA
Ribbed Turtleneck Long Sleeve Mini Dress,Plain,High Neck
Slant Pocket Elastic Waist Track Shorts,Plain,NA
Marbled Knit Drawstring Waist Joggers,Plain,NA
Allover Print Mock Neck Bodycon Dress Without Belted,All Over Print,Stand Collar
Frill Trim Ruched Bust Cami Top,Plain,Spaghetti Strap
Tie Dye Split Hem Pants,Tie Dye,NA
Floral Twist Cut Out Cami Dress,Floral,Spaghetti Strap
Ruched Detail Straight Hem Skirt,Plain,NA
Lace & Lettuce Trim Rib-knit Dress,Plain,Spaghetti Strap
Knot Waist Rib-knit Solid Leggings,Plain,NA
Ditsy Floral Print Tie Shoulder High Split Hem Bustier Dress,Ditsy Floral,Spaghetti Strap
Rib-knit Tube Bodycon Dress,Plain,Strapless
Flare Leg Plaid Pants,Plaid,NA
Tie Shoulder Ditsy Floral Cami Bodycon Dress,Ditsy Floral,Spaghetti Strap
O-ring Zipper Fly PU Leather Pants,Plain,NA
Drop Shoulder Letter & Figure Graphic Tee,Letter  Figure,Round Neck
Zipper Placket Rib-knit Crop Tee,Plain,V neck
Allover Print Longline Tee,All Over Print,V neck
V-neck Tape Detail Tank Dress,Tribal,V neck
Surplice Neck Rib-knit Solid Crop Tee,Plain,V neck
High Waist Cord Skirt,Plain,NA
Buckle Belted Boxy Pleated Overall Dress,Plain,Deep V Neck
Marble Print Flare Leg Pants,Marble,NA
High Waist Plaid Flare Leg Pants,Plaid,NA
High Waist Solid Leggings,Plain,NA
Tie Front Dip Hem Cami Dress,Plain,Spaghetti Strap  Tie Neck
BASICS Solid V Neck Cami Top,Plain,Spaghetti Strap  V neck
Ruffle Trim Wrap Belted Floral Print Skirt,Floral  All Over Print,NA
SBetro Off Shoulder Mini Lace Dress,Plain,Off the Shoulder
Scoop Neck Bishop Sleeve Tee,Plain,Scoop Neck
Sollinarry Elastic Waist Fold Pleat Wide Leg Pants,Plain,NA
Angel Print Contrast Raglan Sleeve Tee,Figure,Round Neck
Figure Graphic Batwing Sleeve Tee,Figure,Round Neck
Slant Pocket Belted Tartan Pants,Tartan,NA
Elastic Waist Cartoon & Letter Graphic Joggers,Cartoon  Letter,NA
Solid Round Neck Self Tie Bodycon Dress,Plain,Round Neck
Self Belted Floral Dress,Floral,Round Neck
Lettuce Trim Waffle Knit Crop Cami Top,Plain,Spaghetti Strap
Button Front Belted Paisley Dress,Paisley,Collar
Button Front Belted Cord Skirt,Plain,NA
BASICS Solid Form Fitted Tee,Plain,Round Neck
