Name,Pattern Type,Neckline
Dot Mesh Insert Ruffle Trim Lace Top,Plain,Stand Collar
Drawstring Waist Solid Sweatpants,Plain,NA
Floral Print Tie Neck Shirred Waist Dress,Floral  All Over Print,Tie Neck
Drawstring Waist Tie Dye Sweatpants,Tie Dye,NA
Dalmatian Bishop Sleeve Tiered Layer Dress,All Over Print,V neck
Allover Butterfly Print Bodycon Dress,Animal  All Over Print,Square Neck
Zebra Stripe Split Hem Skinny Pants,Zebra Stripe,NA
Half Button Pleated Belted Shirt Dress,Plain,Stand Collar
Tie Front Color Block Top,Colorblock,NA
Heart & Butterfly Print Round Neck Tee,Animal  Heart,Round Neck
Double Crazy Sweetheart Neck Cut-out Ruffle Hem Schiffy Dress,Plain,Sweetheart
Striped Flare Leg Pants,Striped,NA
Double V-Neck Tribal Tape Trim Cami Top,Tribal,Spaghetti Strap
Plaid Skater Skirt,Plaid,NA
Mock-neck Rib-knit Crop Tank Top,Plain,Stand Collar
Knot Waist Slant Pocket Solid Joggers,Plain,NA
X Floral Off Shoulder Bodycon Dress,Floral,Off the Shoulder
Double V-Neck Ditsy Floral Cami Dress,Ditsy Floral,Spaghetti Strap
Marble Print Contrast Stitch Bodycon Dress,Marble,Round Neck
Ribbed Panel Halter Top,Plain,Halter
Color-block Drawstring Waist Joggers,Colorblock,NA
Double Crazy Pocket Side Wide Leg Pants,Plain,NA
V Cut Mesh Overlay Maxi Dress,Plain,Round Neck
Slogan Graphic Short Sleeve Tee,Slogan,Round Neck
Allover Letter Print Long Blouse Without Belt,Letter  All Over Print,Collar
Wide Waistband Contrast Binding Marled Knit Shorts,NA,NA
Contrast Top-stitching Crop Tee,NA,Round Neck
Double Crazy Drawstring Knot Velvet Bodycon Dress,Plain,Spaghetti Strap
Solid Garment Eyelet Mini Skirt,Plain,NA
Flounce Sleeve Twist Front Crop Top,Plain,Deep V Neck
One Shoulder Zebra Stripe Slim Tee,Zebra Stripe,One Shoulder
Split Thigh Rib-Knit Tank Dress,Plain,Scoop Neck
Slant Pocket Plaid Pants With Chain,Plaid,NA
Ruffle Armhole Shirred Hem Polka-dot Top,Polka Dot,V neck
Cold Shoulder Rib-knit Tee,Plain,Cold Shoulder
Missord Double Deep V-neck Mermaid Hem Prom Dress,Plain,Deep V Neck
Draped Neck Chain Backless Sequin Halter Top,Plain,Halter
Piping Lettuce-Edge Cropped Cami Top,Plain,Spaghetti Strap
Fold Pleated Tailored Pants,Plain,NA
Slant Pocket Solid Sweatpants,Plain,NA
Ruched Front Ruffle Hem Maxi A-line Dress,Plain,Round Neck
Thick Strap Split Thigh Fitted Dress,Plain,Straps
Guipure Lace Panel Keyhole Back Blouse,Plain,Stand Collar
Ribbed Striped Mini Bodycon Dress,Rainbow Stripe,Round Neck
Rib-knit Solid Tee,Plain,Round Neck
Draped Neck Slip Satin Dress,Plain,Spaghetti Strap
Ruched Bust Lettuce Edge Solid Dress,Plain,Square Neck
Drop Shoulder Buttoned Plaid Longline Blouse,Plaid,Collar
BASICS Mock Neck Form Fitted Crop Top,Plain,Stand Collar
Cutout Twist Front Bodycon Dress,Plain,Stand Collar
BASICS Wide Waistband Capri Leggings,Plain,NA
Rib-knit Solid Dress,Plain,Round Neck
SBetro Keyhole Back Guipure Lace Insert Peplum Top,Plain,Stand Collar
Allover Print Slip Dress,All Over Print,Spaghetti Strap
Drawstring Ruched Side Rib-knit Crop Tee,Plain,Round Neck
Letter Graphic Dress,Letter,Round Neck
Neon Orange Zipper Patch Pocket Push Buckle Belted Wind Joggers,Plain,NA
Button Front Corduroy Skirt,Plain,NA
Zip Half Placket Rib-knit Top,Plain,Stand Collar
Cut Out Rib-knit Bodycon Dress,Plain,Boat Neck
Mock Neck Gigot Sleeve Rib-knit Tee,Plain,Stand Collar
Joyfunear Off Shoulder Ruched Glitter Mesh Bodycon Dress,NA,Off the Shoulder
Mock Neck Ribbed Velvet Top,Plain,Stand Collar
Elastic Waist Plaid Flare Leg Pants,Plaid,NA
Ruffle Trim Wrap Tie Side Floral Slip Dress,Floral,Spaghetti Strap
Lace Trim Lettuce Edge Cami Top,Colorblock,Spaghetti Strap
Letter Embroidered Crop Tee,Letter,Round Neck
Surplice Neck Rib-knit Bodycon Dress,Plain,V neck
Split Hem Plaid Dress,Plaid,Spaghetti Strap
Mock Neck Drawstring Side Glitter Top,Plain,Stand Collar
Polka Dot Ruffle Bardot Fitted Dress,Polka Dot,Off the Shoulder
BASICS High Neck Button Detail Top,Plain,Funnel Neck
Solid Rib-knit Flare Leg Pants,Plain,NA
Lettuce Trim Straight Skirt,Plain,NA
Drawstring Ruched Ruffle Hem Leopard Skirt,Leopard,NA
Camo Print leggings,Camo,NA
Allover Heart Print Crop Sheer Mesh Top,Heart  All Over Print,Round Neck
Lettuce Trim Rib-knit Crop Cami Top,Plain,Spaghetti Strap
Solid Ruffle Hem Wrap Knot Dress,Plain,V neck
High Waist Ditsy Floral Cami Dress,Ditsy Floral,Spaghetti Strap
Lettuce Trim Daisy Floral Slip Dress,Ditsy Floral,Spaghetti Strap
Paperbag Waist Slant Pocket Shorts,Plain,NA
Heart Print Ruffle Armhole Striped Dress,Striped  Heart,Round Neck
Graphic Print Short Sleeve Tee,Galaxy  Graphic,Round Neck
Leopard Chevron Panel Colorblock Tee Dress,Colorblock  Leopard,Round Neck
Contrast Lace V-back Smock Dress,Plain,V neck
Polka Dot Ruffle Hem Belted Dress,Polka Dot,Stand Collar
Button Front Fold Pleated Plaid Tweed Suspender Skirt,Plaid,NA
Ruched Detail Double Layered Pleated Dress,Plain,Round Neck
Fold Pleated Detail PU Leather Shorts,Plain,NA
Square Neck Bodycon Dress,Floral,Square Neck
Notch Neck Rib-knit Bodycon Dress,Plain,Notched
Drawstring Waist Rolled Hem Shorts,Plain,NA
Knot Waist Pleated Satin Skirt,Plain,NA
High Waist Solid Leggings,Plain,NA
Off Shoulder Lace Up Front Ruched Mesh Dress,Plain,Off the Shoulder
Notch Neck Crop Tank Top,Plain,Notched
Heart Print Off The Shoulder Flounce Sleeve A-line Dress,Heart,Off the Shoulder
Gold Button Waist Tweed Shorts,Plain,NA
One Shoulder Gigot Sleeve Allover Print Dress,All Over Print,One Shoulder
High Waist Leather Look Biker Shorts,Plain,NA
Joyfunear Solid Flap Pocket Cargo Pants,Plain,NA
Split Hem Plaid Skirt,Plaid,NA
Houndstooth Single Breasted Slit Hem Dress,Houndstooth,Square Neck
Frill Neck Contrast Lace A-line Dress,Plain,Stand Collar
High-rise Solid Skinny Pants,Plain,NA
Ribbed Baby Girl Graphic Tank Top,Letter,Round Neck
Drawstring Ruched Slim Tee,Plain,Round Neck
Rib-knit Solid Crop Cami Top,Plain,Spaghetti Strap
Scallop Trim Ruffle Hem Top,Plain,Square Neck
Tartan Print Skinny Pants,Tartan,NA
Tie Back Self Belted Crisscross Tie Dye Halter Dress,Tie Dye,Halter
Tropical Paperbag Shorts,Tropical,NA
Mixed Scarf Print Flare Leg Pants Without Belt,Paisley  Scarf Print,NA
Daisy Floral Self-Tie Shorts,Floral  All Over Print,NA
Floral & Scarf Print Shorts,Floral  Scarf Print,NA
Button Front Lettuce Trim Rib-knit Tee,Plain,Notched
High Waist Solid Biker Shorts,Plain,NA
Knot Shoulder Split Hem Plaid Pinafore Dress,Plaid,Spaghetti Strap
Allover Dollar Sign Print Footed Leggings,All Over Print,NA
SBetro Ruched Asymmetrical Hem Satin Cami Dress,Plain,Spaghetti Strap
Rib-knit Applique Cami Top,NA,Spaghetti Strap
Ditsy Floral Fit & Flare Mini Dress,Ditsy Floral,V neck
Houndstooth Split Hem Belted Dress,Houndstooth,V neck
Asymmetrical Curved Hem Skirt,Plain,NA
Keyhole Back Mock Neck Solid Blouse,Plain,Stand Collar
Cherry Print Split Hem Skirt,Fruit&Vegetable  All Over Print,NA
Solid Crisscross High-Rise Shorts,Plain,NA
Leopard Scoop Front Cami Top,Leopard,Spaghetti Strap
Tie Shoulder Plaid Overall Dress,Plaid,Spaghetti Strap
Velvet Crop Slim Tee,Plain,Round Neck
Double Breasted 3d Floral Applique Detail Dress,Floral,Lapel
Embroidery Mesh Sheer Peplum Top Without Cami,Plants,Stand Collar
BASICS Off Shoulder Solid Form Fitted Crop Tee,Plain,Off the Shoulder
Tie Neck Solid Blouse,Plain,Tie Neck
Elastic Waist Dinosaur Print Flare Leg Pants,Animal,NA
Ruffle Hem Rib-knit Dress,Plain,Round Neck
Rhinestone Buckle Belted Wide Leg Pleated Pants,Plain,NA
Scallop Square Neck Hanky Ruffle Hem Tee,Plain,Square Neck
SBetro Paperbag Waist Roll Hem Belted Cropped Pants,Plain,NA
Lip Print Drop Shoulder Oversized Tee,Figure  Graphic,Round Neck
Lace Up Seam Front Colorblock Top,Colorblock,Round Neck
Tie Dye Criss Cross Backless Cami Top,Tie Dye,Spaghetti Strap
High Waist Solid Wide Leg Pants,Plain,NA
Elastic Waist Butterfly Print Pants,Animal,NA
Car And Slogan Graphic Choker Neck Tee,Graphic  Slogan,Keyhole Neckline
Ditsy Floral Print Tie Front Lantern Sleeve Dress,Ditsy Floral,Sweetheart
Zip Side Jacquard Skirt,Floral,NA
Button Front Rib-knit Slim Top,Plain,Sweetheart
Mock-neck Velvet Bodycon Dress,Plain,Stand Collar
Allover Print Smock Dress,All Over Print,Round Neck
Twist Front Peekaboo Dress,Plain,Round Neck
Drawstring High-Rise Joggers,Plain,NA
Zipper Side Raw Edge Plaid Tweed Skirt,Plaid,NA
Tie Front Lettuce Trim Flocked Mesh Top Without Bra,Floral,Tie Neck
Tie Back Glitter Skinny Pants,Plain,NA
Lace Detail Solid Velvet Bodycon Dress,Plain,Spaghetti Strap
Surplice Neck Shirred Hem Floral Top,Floral  All Over Print,V neck
Tie Front Lettuce Trim Top,Plain,V neck
Split Hem Plaid Skirt,Plaid,NA
Rib-knit Bodycon Slip Dress,Plain,Spaghetti Strap
Mock Neck Pocket Side Maxi Flowy Dress,Plain,Stand Collar
Zip Side Eyelash Lace Hem PU Skirt,Plain,NA
Split Buttoned Side PU Leather Skirt,Plain,NA
BASICS Mock Neck Bodycon Dress,Plain,Stand Collar
Embroidery Appliques Mesh Tunic Dress,Floral,Round Neck
Button Front Rib-knit Pencil Dress,Plain,Deep V Neck
Button Front Contrast Leopard Tee,Leopard,V neck
4 Pack Short Sleeve Tee,Colorblock,Round Neck
Double Crazy Contrast Sequin Velvet Cami Dress,Plain,Spaghetti Strap
Eyebrow & Letter Graphic Tee,Letter  Figure,Round Neck
Zipper Side Asymmetrical Ruffle Hem PU Skirt,Plain,NA
Button Front Straight Suede Skirt,Plain,NA
Scallop Trim Laser Cut Sleeve Pleated Detail Top,Plain,Round Neck
High Waist Pocket Side Pants,Plain,NA
Slant Pocket Tartan Pants,Plaid,NA
V Neck Lettuce Trim Crop Tee,Plain,V neck
Solid Ruched Bodycon Cami Dress,Plain,Spaghetti Strap
Flap Pocket Solid Cargo Pants,Plain,NA
Knot Strap Ruched Bust Split Hem Floral Slip Dress,Floral,Spaghetti Strap
Asymmetrical Hem Skort,Plain,NA
Fold Pleated Striped Pants,Striped,NA
Windowpane Plaid Rolled Cuff Blouse,Plaid,Round Neck
Plaid Pattern Overall Dress,Plaid,Straps
Letter & Butterfly Graphic Longline Tee,Letter  Animal,Round Neck
Drawstring Side Button Front Shirt Dress Without Belt,Plain,Collar
Letter Tape Waist Joggers,Letter,NA
Striped Split Thigh Tee Dress,Striped,Round Neck
Chinese Character And Hot Pot Print Tee,Graphic  Slogan,Round Neck
Tie Front Polka-dot Print Bardot Top,Polka Dot,Off the Shoulder
Contrast Binding Dinosaur Print Slip Dress,Cartoon,Spaghetti Strap
Slogan and Figure Graphic Longline Oversized Tee Without Bag,Letter  Figure,Round Neck
Ditsy Floral Button Up Dress,Ditsy Floral,V neck
Lantern Sleeve Eyelash Lace Trim Belted Dress,Plain,V neck
Heart & Butterfly Print Round Neck Tee,Animal  Heart,Round Neck
Solid Bodycon Dress,Plain,Round Neck
Overlap Back Scallop Hem Crop Top,Plain,Spaghetti Strap
Flap Pocket Drawstring Waist Shorts,Plain,NA
Split Hem Solid Skort,Plain,NA
M-Slit Hem Grid Skirt,Plaid,NA
All Over Print Knot Side Wrap Hem Dress,All Over Print,Round Neck
Double Crazy Lantern Sleeve Frill Trim Skater Dress,Plain,Sweetheart
Ruched Drawstring Front Shirred Waist Ditsy Floral Peekaboo Cami Dress,Ditsy Floral,Spaghetti Strap
Rhinestone Lace Up Front Contrast Stitch Colorblock Tank Top,Colorblock,Sweetheart
Drop Shoulder Tartan Longline Blouse,Tartan,Collar
BASICS Solid Bodycon Tube Dress,Plain,Strapless
V Neck Laddering Strap Back Polka Dot Dress,Polka Dot,V neck
Plaid Cami Bodycon Mini Dress,Plaid,Spaghetti Strap
Rusttydustty Lantern Sleeve Ditsy Floral Smock Dress,Ditsy Floral,Tie Neck
Drop Shoulder Tie Dye Crop Tee,Tie Dye,Round Neck
Hook And Eye Cow Print Cami Top,Animal,Scoop Neck
Letter Graphic Striped Dress,Striped  Letter,Round Neck
Criss Cross Waist Drawstring Side Bodycon Dress,Plain,Round Neck
Zipper Side M-split Hem Plaid Skirt,Tartan,NA
Panda Graphic Marble Knit Tee,Cartoon,Round Neck
Slogan and Striped Dress,Striped  Colorblock,Round Neck
Contrast Panel Knot Front Skirt,Striped  Colorblock,NA
Solid Velvet Cami Top,Plain,Spaghetti Strap
Mock Neck Contrast Mesh Colorblock Tee,Colorblock,Stand Collar
Flounce Sleeve Solid Blouse,Plain,Round Neck
Joyfunear Solid Flap Pocket Cargo Pants,Plain,NA
Wrap Solid Knot Shorts,Plain,NA
High Waist Cut Out Solid Pants,Plain,NA
Drawstring Side Rib-knit Tank Top,Plain,Scoop Neck
Eilly Bazar Off Shoulder Lace Overlay Mini Dress,NA,Off the Shoulder
Solid Elastic Waist Teddy Pants,Plain,NA
Buttoned Wide Waistband Skirt,Plain,NA
Lace Trim Leopard Top,Leopard,Sweetheart
Ruched Bust Rib-knit Crop Tee,Plain,Scoop Neck
Lettuce Trim Seam Front Heart Print Top,Heart,Round Neck
Solid High-Rise Joggers,Plain,NA
Solid Drawstring Waist Sweatpants,Plain,NA
Plants Print Short Sleeve Tee,Plants,Round Neck
Drawstring Waist Solid Track Shorts,Plain,NA
Abstract Print Lettuce Trim Mesh Skirt,Tribal,NA
Ruched Mesh Cami Top,Plain,Spaghetti Strap
Cut Out Tie Side Crop Top,Plain,Stand Collar
Asymmetrical Neck Cut Out Bodycon Dress,Plain,Asymmetrical Neck
Slant Pocket Drawstring Waist Shorts,Plain,NA
Contrast Lace Surplice Neck Flounce Sleeve Dress Without Belt,Colorblock,V neck
Crisscross Back Crop Tee,Plain,V neck
Single Breasted Rib-knit Bodycon Dress,Plain,Scoop Neck
Knife Pleat High-Rise Mini Skirt,Plain,NA
Glamaker Tied Split Back Leopard Maxi Dress,Leopard,Spaghetti Strap
Paperbag Waist Self Belted Slant Pocket Tailored Pants,Plain,NA
Corduroy Button Front Flare Skirt,Plain,NA
Ombre Layered Tutu Skirt,Ombre,NA
High Waist Cord Flare Leg Pants Without Belt,Plain,NA
Tartan Crop Cami Top,Tartan,Spaghetti Strap
Lettuce Trim Tie Front Rib-knit Peekaboo Top,Plain,V neck
Mock Neck Solid Bodycon Dress,Plain,Stand Collar
Tied Split Thigh Side Pants,Plain,NA
Notch Neck Form Fitted Tank Top,Plain,Notched
Zip Up Crocodile Embossed PU Leather Skirt,Crocodile,NA
Corduroy O-ring Zip Detail Mini Skirt,Plain,NA
Ruffle Detail Floral Print Bodice Shirt Dress,Floral,Collar
SBetro Elastic Waist Ruffle Hem Velvet Skirt,Plain,NA
BASICS Mock Neck Solid Rib-knit Tee,Plain,Stand Collar
Notch Neck Rib-knit Dress,Plain,Notched
Ruffled Leopard Print Mini Skater Skirt,Leopard,NA
Solid Crop Tank Top,Plain,Scoop Neck
Joyfunear Allover Print Ruffle Hem Drawstring Peekaboo Dress,Leopard,V neck
Botanical Embroidered High-Rise Mini Skirt,Tribal,NA
Rhinestone Lace Up Back Dress,Plain,Funnel Neck
Button Front Tweed Sleeveless Dress,NA,Scoop Neck
Ditsy Floral Print Cami Dress,Ditsy Floral,Spaghetti Strap
Cap Sleeve Leopard Print Bodycon Dress,Leopard,Round Neck
Corduroy V-neck Flounce Sleeve Solid Smock Dress,Plain,V neck
Lace Trim Cow Print Cami Top,Animal,Spaghetti Strap
Swiss Dot Frill Shirred A-line Dress,Plain,Square Neck
Graphic Print Short Sleeve Tee,Graphic,Round Neck
Zebra Striped Twist Front Top,Zebra Stripe,Deep V Neck
Flounce Sleeve Lettuce Trim Tee,Plain,Stand Collar
Rib-knit Solid Crop Cami Top,Plain,Spaghetti Strap
Cowl Neck Satin Cami Dress,Plain,Spaghetti Strap
Solid Gigot Sleeve Dress,Plain,V neck
Self Belted Spliced Allover Print Panel Dress,Colorblock  Graphic,Round Neck
Glitter Waist Mesh Overlay Skirt,Plain,NA
Drop Shoulder Tartan Crop Blouse,Tartan,Collar
High Waist Polka Dot Flare Leg Pants,Polka Dot,NA
Double Button Plaid Tweed Overall Dress,Plaid,Scoop Neck
Tartan Plaid Pleated Skirt,Plaid,NA
Wrap Tie Side Skirt,Plain,NA
Zebra Stripe Lace Trim Bodycon Dress,Zebra Stripe,Spaghetti Strap
Tie Dye Crop Tee,Tie Dye,Round Neck
Surplice Neck Crop Tee,Plain,V neck
Ditsy Floral Tie Side High Low Skirt,Ditsy Floral,NA
Off Shoulder Bishop Sleeve Floral Organza Maxi Dress,Floral,Off the Shoulder
Allover Floral Tie Front Crop Top,Floral  All Over Print,Deep V Neck
Ditsy Floral Ruffle Hem Skirt,Ditsy Floral,NA
Fold Pleated O-ring Belted Satin Pants,Plain,NA
Sweetheart Neck Allover Floral A-line Dress,Floral  All Over Print,Sweetheart
Joyfunear Cowl Neck Drawstring Ruched Satin Dress,Plain,Spaghetti Strap
Square Neck Polk Dot Tie Cuff Dress,Polka Dot,Square Neck
Hook & Eye Closure Rhinestone Fishnet Pants Without Panty,Plain,NA
Snakeskin Print Crisscross Cutout Ruched Dress,Snakeskin Print,Straps
Drawstring Side Satin Crop Halter Top,Plain,Halter
Tartan Pleated Hem Skirt,Tartan,NA
Mock Neck Ruched Sequin Dress,Plain,Stand Collar
Off-the-Shoulder Mesh Insert Mini Dress,Plain,Off the Shoulder
Drop Shoulder Tee Dress,Plain,V neck
Plaid Print Pleated Skirt,Tartan,NA
Fringe Trim Tweed Dress,Plaid,Round Neck
Ditsy Floral Flounce Sleeve Smock Dress,Ditsy Floral,Stand Collar
Lace Up Backless Tie Dye Bodycon Dress,Tie Dye,Spaghetti Strap
Chinese Dragon Print Crop Tee,Animal,Round Neck
Surplice Neck Velvet Crop Cami Top,Plain,Spaghetti Strap
V Neck Solid Velvet Bodycon Dress,Plain,V neck
O-ring Detail Ruched Split Thigh Skirt,Plain,NA
V-neck Button Front Tee,Plain,V neck
Drop Shoulder Slogan Graphic Tee Dress,Slogan,Round Neck
Leopard Print High-Low Midi Skirt,Leopard,NA
High Waist Zipper Back Skater Skirt,Plain,NA
Planet Print Crew Neck Tee,Cartoon,Round Neck
Knot Front Lace Trim Rib-knit Top,Plain,V neck
Mock-neck Fitted Crop Tee,Plain,Stand Collar
Lip Print Drop Shoulder Oversized Tee,Figure  Leopard,Round Neck
Los Angeles Graphic Oversized Tee,Letter,Round Neck
V-cut Neck Dolman Sleeve Leopard Dress,Leopard,Keyhole Neckline
Keyhole Back Rhinestone Letter Tank Top,Letter,Round Neck
Neon Orange One Shoulder Cutout Ruched Bodycon Dress,Plain,One Shoulder
Lace Up Knot Front Allover Print Crop Tee,All Over Print,Round Neck
MEYSI KIM Eyelet Lace Up Knot Letter Graphic Crop Tee,Letter,V neck
Self Belted Leopard Shirt Dress,Leopard,Collar
Surplice Neck Rib-knit Solid Tee,Plain,V neck
Drawstring Waist Tie Dye Sweatpants,Tie Dye,NA
BASICS High Neck Solid Bodycon Dress,Plain,High Neck
Square Neck Rib-knit Tee,Plain,Square Neck
Petal Sleeve Self Belted Dress,Plain,Round Neck
Allover Floral Pencil Skirt,Floral  All Over Print,NA
Butterfly And Planet Print Oversized Tee,Animal  Galaxy,Round Neck
Drop Shoulder Plaid Blouse,Plaid,Collar
Scoop Neck Drawstring Side Tank Top,Plain,Scoop Neck
Paperbag Waist Two Tone Striped Skirt,Striped,NA
Rib-knit Marled Crop Cami Top,Plain,Spaghetti Strap
Lace Up High Waist PU Leather Skirt,NA,NA
Dragon Print Lettuce Trim Crop Tank Top,Animal,Notched
Color Block Ruffle Hem Dress,Colorblock,Round Neck
ADYCE Solid One Shoulder Split Thigh Pencil Dress,Plain,Off the Shoulder
Katy Perrys Picks Ditsy Floral Smocked M-Slit Midi Dress,Ditsy Floral,Off the Shoulder
Elastic Waist Slant Pocket Solid Joggers,Plain,NA
Button Front Ruffle Hem Dress Without Belt,Plain,Collar
Twist Hem Tie Dye Dress,Tie Dye,V neck
Solid Biker Shorts,Plain,NA
Ditsy Floral Smocked Peplum Top,Ditsy Floral,Square Neck
Tie Dye Bodycon Dress,Tie Dye,Spaghetti Strap
Knot Cuff Flap Detail Shirt Dress,Plain,Collar
Slit Hem Solid PU Leather Skirt,Plain,NA
Boxy Pleated Skirt,Plain,NA
High Waist Flare Leg Pants,Plain,NA
Open Back Plunging Halter Neck Slip Dress,Plain,Deep V Neck  Halter
M-slit Hem Buffalo Plaid Dress,Plaid,Round Neck
Scallop Edge Waist Mesh Overlay Skirt,Plain,NA
Tied Paperbag Waist Seam Front Pants,Plain,NA
Flocked Floral Sheer Mesh Bodycon Dress Without Lingerie Set,Floral,Round Neck
Elastic Waist Pocket Side Wide Leg Pants,Plain,NA
Turtle Neck Rib-knit Top,Plain,High Neck
Lantern Sleeve Ruched Crop Top,Plain,V neck
Glamaker Bishop Sleeve Ruched Bardot Dress,Plain,Off the Shoulder
Ditsy Floral Lantern Sleeve Split Thigh Dress,Ditsy Floral,V neck
Frog Button Detail Split Hem Satin Skirt,Plain,NA
Plaid Overall Dress Without Tee,Plaid,Straps
Button Front Plaid Tweed Dress,Plaid,Scoop Neck
Rib-knit Crop Cami Top,Plain,Spaghetti Strap
Solid Suede Skater Skirt,Plain,NA
Camo Elastic Waist Sweatpants,Camo,NA
Guipure Lace Short Sleeve Tee,Plain,Round Neck
Split Hem Cow Pattern Mini Skirt,Animal,NA
Contrast Guipure Lace Swiss Dot Chiffon Blouse,Plain,V neck
Rose Print Self-Tie Braided Cami Dress,Floral  All Over Print,Spaghetti Strap
Corduroy Kangaroo Pocket Mini Overall Dress,Plain,Straps
Figure Graphic Batwing Sleeve Tee,Figure,Round Neck
Mock-neck Marble Fitted Tee,Marble,Stand Collar
Asymmetrical Neck Solid Top,Plain,Asymmetrical Neck
Butterfly Sleeve Floral Top,Floral  All Over Print,High Neck
Keyhole Neck Striped Tunic Dress,Striped,Keyhole Neckline
Geo Print V Neck Tee,Geometric,V neck
Striped Batwing Sleeve Mini Dress,Striped,Round Neck
Plaid High-Rise Slit Mini Skirt,Tartan,NA
Heart Print Paper Bag Waist Belted Shorts,Heart,NA
Crisscross Letter Tape Detail Mesh Insert Leggings,Striped  Letter,NA
Garment Eyelet Drawstring Waist PU Leather Pants,Plain,NA
X Les Do Makeup Drawstring Solid Pants,Plain,NA
Crisscross Tie Backless Rib-knit Cami Top,Plain,Spaghetti Strap
Plaid Print Skort,Plaid,NA
High Waist Belted Plaid Skirt,Plaid,NA
Solid Biker Shorts,Plain,NA
BASICS Round Neck Solid Bodycon Dress,Plain,Round Neck
Off Shoulder Button Front Tee,Plain,Off the Shoulder
High Waist Split Hem Velvet Pencil Skirt,Plain,NA
Rib-knit Cropped Leggings,Plain,NA
Slant Pocket Textured Joggers,Plain,NA
Solid Button Through Satin Blouse,Plain,Collar
Tie Open Back Frilled Flounce Hem Dress,Plain,V neck
Tie Back Crop Cami Top,Plain,Spaghetti Strap
Flocked Polka Dot Sheer Mesh Sleeve Ribbed Top,Plain,Round Neck
O-ring Zip Detail Corduroy Skirt,Plaid,NA
Sequin Heart Detail Tee,Heart,Round Neck
Lace Trim Velvet Cami Top,Plain,Spaghetti Strap
Plunging Neck Tie Back Floral Print Dress,Floral,Deep V Neck
Tartan Slit Hem Skirt,Tartan,NA
High-Rise Slant Pockets Skinny Pants,Plain,NA
Chinese Dragon Print Tied Open Back Crop Top,Animal,Round Neck
Lantern Sleeve Sweetheart Neck Crop Top,Plain,Sweetheart
Split Hem Tartan Bodycon Dress,Tartan,Spaghetti Strap
Swiss Dot Tie Neck A-line Dress,Plain,Tie Neck
Split Hem Corduroy Mini Skirt,Plain,NA
MIUSOL Mock Neck Cut Out Split Hem Dress,Plain,Stand Collar
Draped Neck Satin Fitted Slip Dress,Plain,Spaghetti Strap
Plaid Mini Bodycon Skirt,Plaid,NA
Tie Organza Shoulder Crop Cami Top,Plain,Straps
BASICS Scoop Neck Bodycon Dress,Plain,Scoop Neck
Chinese Character & Dragon Print Tee,Letter  Animal,Round Neck
Ditsy Floral Print Lettuce Edge Dress,Floral  All Over Print,Spaghetti Strap
Surplice Neck Crisscross Back Split Thigh Dress,Plain,Deep V Neck  Spaghetti Strap
Paisley Patchwork Shorts,Paisley  Patchwork,NA
Rib-knit Skinny Leggings,Plain,NA
Solid Crisscross Self-Tie Crop Top,Plain,V neck
Button Split Front Wrap Fitted Dress,Plain,Deep V Neck
Snakeskin Print One-Shoulder Crop Top,Snakeskin Print,One Shoulder
Leopard Print Tie Neck Bishop Sleeve Blouse,Leopard,Tie Neck
Solid Rib-Knit Tank Top,Plain,Round Neck
Satin Self-Tie Cami High Slit Midi Dress,Plain,Spaghetti Strap
Button Front Houndstooth Bodycon Dress,Houndstooth,Square Neck
Surplice Wrap Belted Floral Print Cami Dress,Floral  All Over Print,Spaghetti Strap
Suede Button Front Mini Skirt,Plain,NA
One Shoulder Slit Pep Hem Dress,Plain,One Shoulder
High Waist Leather Look Mini Bodycon Skirt,Plain,NA
BASICS High Waist Bodycon Skirt,Plain,NA
Split Thigh Solid Bodycon Dress,Plain,Round Neck
Leopard Print Self Belted Wrap Dress,Leopard,V neck
BASICS Solid Tee Dress,Plain,Round Neck
Ribbed Self-Tie Long Sleeve Crop Top,Plain,Tie Neck
BASICS Drawstring Waist Slant Pocket Palazzo Pants,Plain,NA
Knot Front Sequins Tapered Pants,Plain,NA
Tie Front Floral and Tribal Print Wide Leg Pants,Floral  Tribal,NA
Paperbag Waist Plaid Pants,Plaid,NA
Solid Biker Shorts,Plain,NA
Solid Self Tie Tunic Dress,Plain,Round Neck
Tartan Mini Bodycon Skirt,Tartan,NA
Flare Leg Houndstooth Pants,Houndstooth,NA
Dragon Print Cut Out Front Dress,Animal,Stand Collar
Draped Neck Split Hem Satin Slip Dress,Plain,Spaghetti Strap
Bell Sleeve Surplice Neck Asymmetrical Hem Dress,Plain,V neck
Off Shoulder Shirred Waist Frill Trim Dress,Plain,Off the Shoulder
Wrap Front Draped Detail Satin Skirt,Plain,NA
Contrast Tape Zipper Pocket Cargo Pants,NA,NA
Wide Waistband Biker Shorts,Plain,NA
Drop Shoulder Solid Top,Plain,Round Neck
Joyfunear Frill Trim Layered Hem Floral Cami Dress,Floral  All Over Print,Spaghetti Strap
Belted Floral Print Sweetheart Neck Maxi Dress,Floral  All Over Print,Sweetheart
Rib-knit Crop Top,Plain,Round Neck
BASICS Split Hem Bodycon Dress,Plain,Round Neck
Lantern Sleeve Shirred Ruffle Hem Dress,Plain,Stand Collar
SBetro High Waist Straight Leg Pants,Plain,NA
Puff Sleeve Split Thigh Floral Print Dress,Floral  All Over Print,Sweetheart
Ribbed Surplice Form-Fitting Crop Top,Plain,V neck
Tie Dye Tie Back Satin Cami Bandana Top,Tie Dye,Spaghetti Strap
Square Neck Ruched Bust Mesh Dress,Plain,Square Neck
BASICS Wide Waistband Solid Leggings,Plain,NA
Botanical Print Pencil Skirt,Floral  Plants,NA
BASICS Stand Collar Bodycon Dress,Plain,Stand Collar
Button Up Crop Tee,Plain,Round Neck
Plunging Neck Cold Shoulder Ruched Asymmetrical Hem Dress,Plain,Halter
Frill Trim Tiered Layer Midi Cami Dress,Plain,Spaghetti Strap
Tie Open Back Rib-knit Crop Tee,Plain,Stand Collar
Zip Side Pleated Skirt,Plain,NA
Kimberly Loaiza Knot Hem Self Belted PU Leather Pants,Plain,NA
Wideband Waist Pleated Mesh Skirt,Plain,NA
Tie Waist Fishnet Mesh Leggings Without Panty,Plain,NA
Gingham Overall Dress,Gingham,Spaghetti Strap
Clip Dot Sheer Bishop Sleeve Crop Top,Plain,Sweetheart
Colorblock Striped High-Rise Leggings,Colorblock,NA
D&M Ruched Crisscross Rhinestone Detail Velvet Cami Dress,NA,Spaghetti Strap
Elastic Waist Cargo Joggers,Plain,NA
V Neck Rib-knit Crop Top,Plain,V neck
Ditsy Floral Self-Tie Cami Peplum Top,Plants  All Over Print,Spaghetti Strap
Press Button Half Placket Striped Tee,Striped,Scoop Neck
Contrast Tape Sequin Sleeve Belted Velvet Dress,Colorblock,Round Neck
Notched Neck Rib-knit Lettuce Hem Bodycon Dress,Plain,Notched
Butterfly Print Tie Dye Pants,Tie Dye  Animal,NA
Solid Slant Pocket Swing Skirt,Plain,NA
Asymmetrical Neck Rib-knit Belted Dress,Plain,Asymmetrical Neck
High Waist Plaid Pleated Skirt,Plaid,NA
Solid Crew Neck Tee,Plain,Round Neck
Crisscross PU Leather Cami Bodycon Dress,Plain,Spaghetti Strap
Floral Print Maxi Skirt,Floral,NA
Eyelet Lace Up Tie Back Bustier Bandeau Crop Top,Plain,Strapless
Plaid Flare Mini Skirt,Plaid,NA
Angel & Letter Graphic Tee,Letter  Figure,Round Neck
Crisscross PU Leather Cami Bodycon Dress,Plain,Spaghetti Strap
Self Belted Ditsy Floral Maxi Cami Dress,Ditsy Floral,Spaghetti Strap
Cross Wrap Front Tie Back Crop Top,Plain,V neck
Wide Leg Corduroy Pants,Plain,NA
BASICS Solid Spaghetti Neck Bodycon Dress,Plain,Spaghetti Strap
